download_date,published_date_gmt,title,url,category,raw_text
1031,2024-10-31 14:21:30,Do Diets Really Work,https://www.recentlyheard.com/do-diets-really-work/,Health,"Writer

Peter Karpouzas

Revealed

March 20, 2015

Phrase rely

543

I used to be studying the paper (The Age, 28/03/12) the opposite day and stumbled upon an article on weight reduction. It stated:

“Greater than 50 years of analysis confirms that diets have a failure charge of between95 to 98 p.c. That is proper – of each 100 individuals who weight loss plan, 98 of them will shortly restore any weight they do lose.

In keeping with the US Nationwide Institute of Well being Know-how evaluation convention, “(weight-loss) interventions produce quick time period losses adopted by weight achieve again, and no current therapies seem able to producing everlasting weight-loss.”.

That may be a damning analysis of weight loss plan plans! So if the place want to change our physique form, what can we do?

Plenty of the weight loss plan plans in existence deal with meals as a mere gas with none allowance for the pleasures that meals could convey. Meals is barely as an enter and the output it produces. This place implies that varied sorts of meals are recognized as nice and dangerous. This meals is nice gas. This meals is dangerous gas. This labelling of meals develops resistance. This meals is dangerous! These emotions of guilt that you just really feel as you devour these chips or donuts can impact the strategy our physique takes within the constituents of the meals. It implies that our physique isn’t in sympathy with the meals we eat. It could actually simply point out a destructive consequence. That’s placing on weight, being the consequence.

What if we proclaimed:.

“Meals is my buddy!”.

Now we are able to consider the well being and wellbeing that meals we devour promotes. This well being and wellbeing can embrace the pleasure meals brings us (how nice is a donut to devour?) together with diet. This enjoyment of consuming is usually peoples failure in weight-loss on account of the truth that it could really feel nice nonetheless the end result is miserable.

If we settle for there’s a divine pressure, life pressure, life power or supreme being, then it opens the likelihood to deal with your physique as greater than merely a tool. It allows us to utilize the magnificent legislation of vacation spot in creating the physique we need.The legislation of vacation spot informs us that “like brings in like”. For that purpose if we predict a meals is dangerous we will definitely draw within the issues that we’re afraid most! That’s, weight achieve. So while you subsequent sit right down to eat, consciously deal with the feeling you’ve gotten about this meals. It’s totally probably that the sensation is destructive.

If the meals is strictly what we might determine “dangerous” you’ll almost definitely have a grating, destructive sensation.

If the meals is strictly what we might name “good” the emotions probably extra favorable, however you may need resentment since you really feel you need to eat this sort of meals to maintain your physique.

It’s efficiently a struggle towards meals, when it must be recognized that meals is required for our wellbeing.

So when you have these type of sensations try:.

“Meals is my buddy!”.

“Designer Our bodies” is a program that makes use of the Regulation of Vacation spot to develop the physique we need. Our “Designer Physique”.

Designer Our bodies intends to fully alter our sensations and emotions about meals and our our bodies to develop the physique you need. Your “Designer Physique.”."
1031,2024-10-31 14:21:04,"Tougher limits on salt in packaged foods could save thousands of lives, study shows",https://medicalxpress.com/news/2024-10-tougher-limits-salt-packaged-foods.html,Health,"This article has been reviewed according to Science X's editorial process and policies . Editors have highlighted the following attributes while ensuring the content's credibility:

Credit: CC0 Public Domain

Introducing tougher restrictions on sodium levels for packaged food could prevent thousands of deaths and save billions of dollars in health spending in Australia alone, a new study shows.

Mandating stringent targets for sodium levels in Australian packaged foods in line with World Health Organization (WHO) recommendations could prevent about 40,000 cardiovascular events and up to 3,000 deaths over a 10-year period, according to new research published on Thursday in the The Lancet Public Health.

Around 32,000 new cases of kidney disease could also be avoided and some $3.25 billion in health care costs saved over the population's lifespans.

Led by researchers at The George Institute for Global Health in collaboration with UNSW Sydney, Griffith University and Johns Hopkins University, the study is the first to project the long-term impacts of setting mandatory sodium reduction targets for processed foods, by comparing the Australian government's current voluntary benchmarks with the higher targets recommended by the WHO.

Excessive sodium intake is a major killer globally, contributing to cardiovascular disease (CVD) and chronic kidney disease (CKD). In Australia, average daily consumption is almost double what is recommended by the WHO, with the majority coming from salt hidden in foods like processed meats, bread and bakery products, cereal and grain products, and dairy products.

Study author Professor Jason Wu, Head of Nutrition Science at The George Institute and a Professor at UNSW Medicine & Health's School of Population Health, said the analysis showed that setting sodium reduction levels higher than the current Australian targets, and making them mandatory, could bring significant health benefits and reduce the burden of CVD and CKD on the health care system.

""Our study projected enormous reductions in both cases and deaths from heart attacks, strokes and other heart conditions, as well as from kidney disease, within just a decade if the WHO reduction targets were mandated. Beyond 10 years, we also showed that this reduction in disease burden could generate billions of dollars in savings from health care costs related to these diseases,"" he said.

The WHO recommends reformulating food products to reduce sodium levels as part of its goal to decrease sodium consumption by 30% globally by 2025. This is also a component of the Australian federal government's Healthy Food Partnership (HFP), launched in 2015, which asks the food industry to reduce sodium levels across 27 food categories, among other measures to support healthy eating.

""Australia's sodium reformulation targets not only remain voluntary, but are also less rigorous than the WHO sodium benchmarks. We see industry consistently failing to meet voluntary targets and this weak regulatory system means Australia is missing an opportunity to protect its people from harmful effects of eating too much sodium,"" Prof. Wu added.

""Other countries such as Brazil, Mexico, Spain and Malaysia have adopted mandatory sodium limits, so it can be done. We have now shown that if Australia adopted these more effective benchmarks and made them compulsory, it could help relieve the strain on our health care system over the next few decades.""

Griffith University's Dr. Leopold Aminde from the School of Medicine and Dentistry said the research exemplifies the reasons why Australia must now move away from a voluntary approach to mandating sodium thresholds for packaged foods.

Credit: University of New South Wales

""Curtailing excessive sodium consumption has the ability to prevent thousands of deaths and cases of cardiovascular disease and chronic kidney disease, coupled with the added economic cost-saving benefits for Australia's health system,"" Dr. Aminde said.

""Our analysis shows these benefits could be three-to-four times greater when stringent sodium thresholds, such as those proposed by the WHO, are mandated compared to the existing voluntary targets.""

Dr. Luz Maria De Regil, Head of the Multisectoral Actions in Food Systems unit, Department of Nutrition and Food Safety at the WHO said, ""With only voluntary measures in place to reduce sodium in the food supply, Australia may not offer to all its population adequate protection from heart attack, stroke, and other health problems.

""The WHO is calling on all countries to implement our 'best buy' interventions for sodium reduction, and on governments to mandate that manufacturers implement the WHO benchmarks for sodium content in food.""

More information: Matti Marklund et al, Estimated health effect, cost, and cost-effectiveness of mandating sodium benchmarks in Australia's packaged foods: a modelling study, The Lancet Public Health (2024). DOI: 10.1016/S2468-2667(24)00219-6 Journal information: The Lancet Public Health"
1031,2024-10-31 14:20:03,New method to analyze complex genetic data could be the key to tackling rare diseases,https://medicalxpress.com/news/2024-10-method-complex-genetic-key-tackling.html,Health,"This article has been reviewed according to Science X's editorial process and policies . Editors have highlighted the following attributes while ensuring the content's credibility:

Credit: CC0 Public Domain

Scientists from the University of Nottingham have developed a new method of genetic analysis, which extracts more precise data than previously used methods when looking at DNA, and will improve our understanding of the genetic basis of rare and complex diseases.

The findings of the study, which are published in Physiological Genomics, explain a new method of analyzing genetics, which determines the extent to which genes are involved in phenotype formation.

The previously used method extracted information using averages from different datasets, meaning that it had limitations in terms of the type of information it could provide, and what scientists could learn from it.

The study was led by Dr. Cyril Rauch, an Associate Professor in Physical and Mathematical Veterinary Medicine and Science at the University of Nottingham.

Genome-wide association studies (GWASs) provide a method to map genotypes—the genetic makeup of an organism, and phenotypes—observational traits such as height or hair color. This helps scientists to understand biology, and in turn, how to treat certain diseases.

Although genomic technologies have advanced quickly, the statistical models used to analyze genotype and phenotype association are based on works developed by scientist R. A Fisher more than 100 years ago. However, there is an ongoing debate in the scientific community over whether this method has reached its limit for truly understanding the genetic basis of rare and complex traits—such as rare diseases.

As the UK wants to capitalize on the success of gene editing technologies, this is something that needs urgently addressing since there can only be useful editing technologies in the cases of rare and complex traits, if precise genotype-phenotype mapping information is available.

In this context, new and more accurate statistical methods maximizing the investigative power of biological or medical data are needed to help define gene targets and future treatments precisely.

Inspired by physics theory, an interdisciplinary team of researchers at the University of Nottingham have dedicated time over the past few years to rethink and change the mathematical foundations of classic GWA methods, so they can maximize the investigative power of genotype/phenotype datasets.

This has resulted in a new method called Genomic Informational Theory (GIFT) that has now been applied successfully to a range of datasets. By removing the informational barrier linked to dataset categories, the team have demonstrated that it is possible to extract more information using GIFT than the previously used GWAS.

Dr. Rauch says, ""One way to represent the difference in the investigative or informational powers of GIFT relative to GWASs is to use an analogy with the magnification power of microscopes. Our results show that comparing the informational (resolution) powers of GIFT relative to GWASs is like comparing an electron microscope (GIFT) to a light microscope (GWASs).

""With increased informational power, GIFT can be applied to relatively large datasets to extract further information and/or to small datasets to extract novel information where GWASs were unable to do so previously. GIFT is particularly well suited for applications in fields were building datasets is difficult, for example, rare diseases.""

More information: Panagiota Kyratzi et al, Investigative power of genomic informational field theory relative to genome-wide association studies for genotype-phenotype mapping, Physiological Genomics (2024). DOI: 10.1152/physiolgenomics.00049.2024"
1031,2024-10-31 14:15:06,Jeff Bezos Goes Screen-Free For An Hour Every Morning - Here's Why,https://www.slashgear.com/1699691/why-jeff-bezos-avoids-screens-morning-reason/,Health,"With new research highlighting the effects of phone use on mental focus, a ""no phones in the bedroom"" approach is gaining popularity. Scientific American studies indicate that reaching for a phone first thing in the morning may set the brain up for distraction, priming it for reactive thinking throughout the day. Lauren Sanchez told People that she and her fiance, Amazon founder Jeff Bezos, who also speaks out about the most important reason humans need to go to space, have a morning routine that excludes phones altogether. In a recent interview with People, Sanchez shared how this tech-free rule helps the couple stay connected and start their day with intention.

""I make myself a cup of coffee. I make Jeff a cup of coffee, and we kind of have this magic moment where it's just us talking,"" Sanchez revealed. She explained that mornings are quiet and undistracted, noting, ""The kids haven't woken up yet. And we don't get on our phones. That's one of the rules."" According to Sanchez, this daily routine is something they strictly adhere to, especially since it allows them to connect before the day's busyness takes over. ""He definitely made that rule,"" she added, sharing how Bezos initiated the no-phone practice."
1031,2024-10-31 14:13:36,Trump Transition Co-Chair Floats Plan To 'Yank' Vaccines 'Off The Market',https://www.huffpost.com/entry/howard-lutnick-trump-vaccines_n_67237fe0e4b02f5ab1d287fe,Health,"LOADING ERROR LOADING

The co-chair of Republican presidential nominee Donald Trump’s transition team promoted the debunked theory that vaccines cause autism in a CNN interview Wednesday. He also said Trump ally Robert F. Kennedy Jr., hopes to get “data” through a Trump administration to have vaccines pulled “off the market.”

Howard Lutnick, the billionaire CEO of investment bank Cantor Fitzgerald and a longtime friend of Trump’s, told the network’s Kaitlan Collins that vaccines are “not proven” to be safe. Lutnick said he’d recently been schooled on vaccines by Kennedy, the failed independent presidential candidate and anti-vaxxer who has endorsed Trump.

Kennedy has said he would have significant influence over public health policy if Trump wins the White House.

“So, I spent two-and-a-half hours this week with Bobby Kennedy Jr., and it was the most extraordinary thing. Because, let’s face it, we’ve all heard on the news all sorts of sort of snarky comments about him,” Lutnick told Collins.

Recounting his conversation with Kennedy, Lutnick went on to link autism to the growth of vaccines — a discredited idea that dates back to a retracted study from 1998 — before Collins interrupted to remind viewers Lutnick is not a scientist.

“Hang on,” the anchor said. “OK, neither of us are doctors. Vaccines are safe.”

“Why do you think vaccines are safe? There’s no product liability anymore. They’re not proven,” Lutnick said.

“Because they’re proven. Kids get them and they’re fine,” Collins said.

“Why do you think they’re fine?” Lutnick responded.

A Trump spokesperson did not immediately respond Thursday morning when asked if the campaign stood by Lutnick’s comments.

Trump transition co-chair Howard Lutnick — in charge of helping staff the gov if he wins — says he had a 2.5 hour meeting with RFK Jr. who talked about pulling (safe and proven) vaccines from the market. Lutnick says RFK will not be in charge of HHS, despite what RFK said. pic.twitter.com/K6wFo6EwqP — Kaitlan Collins (@kaitlancollins) October 31, 2024

Lutnick went on to say that Kennedy wants vaccines pulled off the market ― and that Kennedy hopes a Trump administration could get him the data to accomplish that.

“He wants the data so he can say, ‘These things are unsafe,’” Lutnick said. “He says, ‘If you give me the data, all I want is the data, and I’ll take on the data and show that it’s not safe. And if you pull the product liability, the companies will yank these vaccines right off ― off of the market.’ So that’s his point.”

The former president himself has long voiced skepticism of vaccines and has promised to cut funding for schools that require them, playing into anti-vax conspiracy theories that have gone mainstream in the Republican Party. (All states have variations of laws requiring certain vaccines.)

Trump also engaged in some anti-vax banter with Kennedy during a July phone call captured in a leaked video.

“When you feed a baby, Bobby, a vaccination that is like 38 different vaccines, and it looks like it’s fit for a horse, not a 10-pound or 20-pound baby, it looks like you should be giving a horse this thing,” Trump said on the call.

After Kennedy dropped out of the race and endorsed Trump, the former president gave him a slot on his transition team.

Kennedy told supporters earlier this week that Trump had promised to give him “control” over key public health agencies like the Centers for Disease Control and Prevention.

“The key that I think I’m — you know, that President Trump has promised me is — is control of the public health agencies,” Kennedy said in a livestream, video of which CNN obtained. He cited the Department of Health and Human Services, the Food and Drug Administration and the National Institutes of Health, among others.

Advertisement"
1031,2024-10-31 14:13:00,"Registration is Open for Carry The Load's 100,000 Meter Challenge in Honor of Veterans Day",https://www.benzinga.com/pressreleases/24/10/g41655344/registration-is-open-for-carry-the-loads-100-000-meter-challenge-in-honor-of-veterans-day,Health,"Dallas, Oct. 31, 2024 (GLOBE NEWSWIRE) -- Carry The Load, a non-profit that exists to preserve the sanctity of Memorial Day through community gatherings and storytelling to unite Americans in appreciation for the sacrifices made by a few who carried the load for all, has opened registration for people to participate in a month-long 100,000-meter fitness challenge to commemorate Veterans Day. Carry The Load's 100,000 Meter Challenge is a 31-day event from November 11 through December 11, in which participants can engage in six exercises including running/walking, cycling, rowing, air biking, rucking, and swimming. Individuals and teams track their progress at 100kmc.com. Registration is only $10 per person.

Learn more and register for Carry The Load's 100,000 Meter Challenge at 100kmc.com.

""Our 100,000 Meter Challenge provides an active way for people of all fitness levels to honor those who have served our country,"" says Stephen Holley, co-founder, president, and CEO of Carry The Load and Veteran U.S. Navy SEAL. ""Our goal is to start a fitness movement all across the nation so those who laid their lives on the line for our freedoms can see that their service and sacrifice mattered.""

This year's 100,000 Meter Challenge presenting partner is Government Employees Health Association, Inc. (G.E.H.A), a nonprofit member association that provides medical and dental benefits exclusively to more than 2 million federal employees and retirees, military retirees, and their families. G.E.H.A will have employees and members across the country participating in the challenge.

""As the proud presenting partner of the Carry The Load's 100,000 Meter Challenge, G.E.H.A is honored to support a national initiative that mirrors our dedication to the health and well-being of federal employees, military veterans, and their families,"" says Raj Vavilala, Chief Sales, Marketing, and Product Officer. ""This challenge not only pays homage to those who have bravely served our country but also strengthens the bonds of community and solidarity.""

Unlike Memorial Day that takes place the last Monday in May to honor those who died while serving in the U.S. military, Veterans Day takes place on November 11 to acknowledge and thank everyone who served in the U.S. military. More information can be found on Carry The Load's website www.carrytheload.org.

# # #

ABOUT CARRY THE LOAD

Carry The Load is a 501(c)3 nonprofit founded in 2011 by Veteran U.S. Navy SEALs Clint Bruce and Stephen Holley. The nationwide non-profit organization exists to preserve the sanctity of Memorial Day through community gatherings and storytelling to unite Americans in appreciation for the sacrifices made by a few who carried the load for all. For more, visit www.carrytheload.org or news.carrytheload.org. Connect with us on Facebook, Twitter, Instagram, LinkedIn, and YouTube.

ABOUT G.E.H.A

G.E.H.A (Government Employees Health Association, Inc., pronounced G.E.H.A.) is a nonprofit member association that provides medical and dental benefits to more than 2 million federal employees and retirees, military retirees and their families. Offering one of the largest medical and dental benefit provider networks available to federal employees in the United States, G.E.H.A empowers health and wellness by meeting its members where they are, when they need care. For more, visit www.geha.com or connect on Facebook, Instagram, LinkedIn and YouTube.

Attachment

Renee Cossman Carry The Load 214.723.6068 renee.cossman@carrytheload.org Lisa Chism G.E.H.A 816.434.4560 x3110 Lisa.Chism@geha.com"
