download_date,published_date_gmt,title,url,category,raw_text
1027,2024-10-27 08:00:12,The four 'dreaded' letters on airline boarding passes that travelers say they never want to see,https://www.foxnews.com/travel/four-dreaded-letters-airline-boarding-passes-travelers-say-never-want-see,Tourism,"Should you panic when you see ""SSSS"" printed on your boarding pass? Social media users are going viral for sharing their experiences after noticing the four letters upon arriving at the airport.

So, what does SSSS mean if it appears when you check in?

""SSSS are indeed four dreaded letters that no traveler should want to see on their boarding pass,"" Zach Griff, senior aviation writer for the New York-based travel blog The Point Guys, told Fox News Digital.

AIRLINE TRAVELER GOES VIRAL FOR MIXING COCKTAIL BEFORE BOARDING A PLANE: IS IT LEGAL?

""It stands for ‘secondary security screening selection,’ and it’s a measure implemented by security authorities in the U.S. to screen certain passengers with additional checks.""

The Transportation Security Administration (TSA) will select passengers before the official flight departure.

""Selectees for this enhanced security are chosen in the days leading up to a flight when airlines share the manifest with U.S. security authorities,"" Griff added.

AIRLINE PASSENGER SAYS SHE RECEIVED 'CREEPIEST' TEXT FROM STRANGER WHO SAW PHONE NUMBER ON HER LUGGAGE TAG

Griff said that most people who receive SSSS before a flight will not be able to check in online, and will receive a printed ticket from an agent — this is exactly what happened to Jordyn Verzera and JT Mocarski, creators of the travel blog ""The Mobile Homie.""""

The travel-content-creating duo from Arizona have shared their experiences on TikTok each time they noticed the four S's on their boarding passes.

Whenever they receive the SSSS on boarding passes and post it on social media, users flood them with questions in the comment section.

Verzera and Mocarski told Fox News Digital about what this additional screening process entails.

The first time Verzera and Mocarski encountered the four letters, only one of them was able to check in before their flight.

AIRLINE PASSENGER'S 'AWKWARD' SEATING ARRANGEMENT GOES VIRAL: 'NEVER GOING TO RECOVER'

Verzera attempted to get her boarding pass on the airline's app, but a notification popped up saying she had to check in with a gate agent, she said.

Verzera said she was confused until she spoke to an agent.

""They had to give me a printed boarding pass. He [Mocarski] could still use his digital one, and then I had to carry this pass around. It was marked and circled, and I had to show it like every step along the way,"" Verzera said.

""Instead of just going through one form of security … you had to get to the gate early, and they did an extra-deep screening when you departed. But where the big thing was, is, once we arrived, we actually ended up having to go through customs … and that was when the really deep search began.""

AIRLINE PASSENGERS COULD BE REMOVED FROM FLIGHTS FOR GOING BAREFOOT: ETIQUETTE EXPERT WEIGHS IN

Verzera said that every item she packed had to be removed from her luggage, including her toiletry items. Those items were then laid out on a conveyor belt where everything was swabbed. Her laptop also had to be turned on in order to go through security.

""It was a little intimidating the first time around,"" she said.

Verzera had to arrive early at the airport to receive her boarding pass and had to wait in line for three hours. She said it took her another hour to go through the additional screening in customs.

Back in April, when Mocarski had gone through the SSSS process in Rome, it was significantly faster, he said.

FLIGHT ATTENDANT GOES VIRAL ON TIKTOK FOR ATTEMPTING TO EASE COMMON FLYING FEAR

""It depends on which country … or which place where you're going, like the severity of the search, what it entails,"" Mocarski told Fox News Digital.

""SSSS can also be entirely random, and there’s no way to know when booking your flight whether you’ll be chosen as SSSS."" — Zach Griff, senior aviation writer for the New York-based travel blog, The Point Guys

Griff agreed with Mocarski's point by adding that it depends on the airport you are in, with some requiring an early arrival and a ""complete paydown."" Some airports may require a ""personalized interview, along with more screening.""

Mocarski thinks social media may have slightly villainized the extra security measure, he said.

""At the end of the day, it's random, like even the TSA agents, it's not like they're picking you. They know the remedies that they have to go through to make sure that they're doing the check,"" Mocarski said.

'AIRPORT TRAY AESTHETIC' GOES VIRAL AS SOME TRAVELERS HALT SECURITY CHECKPOINTS FOR PHOTO OPS

""It's just staying calm and just respecting their time. And they'll be back with you.""



""At the end of the day … they're just doing your job,"" he added. ""They're not there maliciously.""

Griff said you might receive the SSSS for a variety of different reasons: ""suspicious travel patterns like frequent one-way international trips, or many visits to high-risk countries,"" he said.

""SSSS can also be entirely random, and there’s no way to know when booking your flight whether you’ll be chosen as SSSS,"" Griff added.

For more Lifestyle articles, visit www.foxnews.com/lifestyle

Verzera said people might be concerned about ""SSSS"" as they feel the extra screening will lead to them missing their flight.

CLICK HERE TO SIGN UP FOR OUR LIFESTYLE NEWSLETTER

She and Mocarski recommend getting travel insurance for this purpose.

They also said that when ""SSSS"" appeared on their boarding passes, the plane ""waited"" and didn't leave any ""SSSS passengers"" behind.

""I think for us, and something we like to remind our friends of, is that travel isn't perfect,"" Verzera said.

""You grow the most when you're uncomfortable with travel – just understand that this happens. Just roll with it, and just let it be part of your day . . . go through it, and then [say], ‘I hope it never happens again.’""

A TSA spokesperson told Fox News Digital via email that SSSS is meant to accomplish the agency's ""transportation security mission.""

""Security measures begin long before passengers arrive at the airport,"" the spokesperson wrote. ""TSA works closely with the intelligence and law enforcement communities to share information. Additional security measures are in place from the time passengers get to the airport until they arrive at their destination. In some cases, passengers are randomly selected for enhanced screening.""

CLICK HERE TO GET THE FOX NEWS APP

No traveler is able to bypass the screening, according to the TSA.

If a traveler experiences difficulties getting through the security screening process, they can reach out to the DHS Travel Redress Program for assistance.

Visit tsa.gov to learn more."
1027,2024-10-27 07:53:30,Saudi Arabia’s $500 Billion NEOM And Red Sea Project Spark A New Era of Luxury Travel,https://www.travelandtourworld.com/news/article/saudi-arabias-500-billion-neom-and-red-sea-project-spark-a-new-era-of-luxury-travel/,Tourism,"Saudi Arabia’s $500 Billion NEOM And Red Sea Project Spark A New Era of Luxury Travel

Saudi Arabia is channeling billions into transformative mega-projects as part of an ambitious plan to position the nation for future global challenges. These projects are expected to reshape the Saudi economy, create countless job opportunities, and enhance quality of life.

One of the most iconic developments is NEOM, a futuristic city on the Red Sea coast envisioned as a hub for sustainability and innovation. With an anticipated investment of $500 billion (£386bn), Saudi leaders aim for NEOM to draw talent from across the globe to live and work in this next-generation urban center.

Riyadh is also making bold moves to expand its tourism sector, moving beyond a reliance on oil and gas. One standout project is The Red Sea Project, a high-end tourism development on Saudi Arabia’s west coast in Tabuk province, stretching across a vast 28,000-square-kilometer area between Umluj and Al-Wajh. Featuring more than 90 pristine offshore islands, 200 km of Red Sea coastline, and diverse landscapes including beaches, mountains, deserts, and even volcanoes, this project promises a unique luxury escape.

Launched by Crown Prince Mohammad bin Salman in 2017 as part of the Saudi Vision 2030 initiative, The Red Sea Project is set to transform Saudi tourism. Upon completion in 2030, it will offer 50 hotels, 8,000 rooms, and over 1,000 residential units spread across 22 islands and six inland locations.

As of 2024, five resort sites are operational, including two inland and three island-based destinations. In May, Ritz-Carlton unveiled the Nujuma resort on the Ummahat Islands, where it joins the luxurious St. Regis Red Sea Resort. Known for its exclusivity, Nujuma has become the Middle East’s most lavish hotel, with nightly rates around £2,627, adding a new level of luxury to Saudi Arabia’s emerging tourism landscape."
1027,2024-10-27 07:49:28,Sri Lanka’s Tourism Industry Struggles Amid Arugam Bay Travel Advisories And Security Concerns With Efforts To Rebuild Confidence For The Upcoming Winter Season,https://www.travelandtourworld.com/news/article/sri-lankas-tourism-industry-struggles-amid-arugam-bay-travel-advisories-and-security-concerns-with-efforts-to-rebuild-confidence-for-the-upcoming-winter-season/,Tourism,"Sri Lanka’s Tourism Industry Struggles Amid Arugam Bay Travel Advisories And Security Concerns With Efforts To Rebuild Confidence For The Upcoming Winter Season

Sri Lanka’s tourism faces a setback as travel advisories raise safety concerns in key regions, impacting a sector vital for economic recovery this winter season.

The recent developments have cast a shadow on Sri Lanka’s tourism industry, a sector that was beginning to see promising signs of recovery. This year, the country’s tourism sector showcased resilience despite challenges, managing to report steady arrival numbers amid a turbulent political transition. However, with the winter season just around the corner, a fresh set of obstacles has emerged, threatening to dampen the anticipated tourism boom that many in the industry had been counting on to offset the economic setbacks caused by COVID-19, the Easter Sunday attacks, and other crises.

Arugam Bay, known for its world-class surfing conditions, has become a focal point of concern following a series of travel advisories issued by multiple countries. Israelis, who form a substantial part of the region’s tourist demographic, have been alerted to potential security threats, prompting countries like the U.S., U.K., Israel, Australia, and Russia to advise caution. Local authorities in Sri Lanka had been aware of possible security risks since early October but opted for a strategic approach to avoid public alarm. Minister of Public Security Vijitha Herath addressed the matter, confirming that the government, under presidential oversight, had taken all necessary security precautions across Arugam Bay and other key tourist areas like Ella and Mirissa.

Impact on Sri Lanka’s Tourism Recovery

Tourism is a lifeline for Sri Lanka, contributing significantly to employment and foreign exchange reserves. For local hoteliers, restaurateurs, and tour operators, the winter season represents a golden opportunity to recover from previous losses. The arrival of international visitors, including surfers and beachgoers, traditionally boosts the sector during this period. Unfortunately, the timing of the travel advisories couldn’t be worse, as the season had shown encouraging signs of a comeback.

The mention of potential violence reignites painful memories of the 2019 Easter Sunday attacks, a traumatic event for the country that shook confidence in Sri Lanka’s safety as a tourist destination. In the wake of these attacks, Sri Lanka’s domestic tourism industry witnessed significant downturns, with lingering concerns about safety that continue to surface in media coverage abroad. The government’s failure to act on reliable intelligence during the Easter Sunday events, coupled with political infighting and slow action on investigation findings, has led to continued scrutiny.

International Travel Advisories: A Blow to Confidence

Following the recent travel advisories, local authorities had no choice but to acknowledge the security concerns. The U.S. was the first to issue a travel advisory, quickly followed by several other nations. This move forced Sri Lankan authorities to break their silence, with the National Security Council reportedly holding several meetings to address the issue. Local officials hope the visible security measures will restore confidence, particularly among tourists currently in Arugam Bay. For now, visitors are still seen enjoying the beaches, with many expressing a lack of concern over the news in televised interviews. However, industry stakeholders remain apprehensive about the long-term effects of this incident on visitor numbers.

Challenges from Within: Sri Lanka’s Political Landscape

Complicating matters further is Sri Lanka’s domestic political landscape. The government is caught in the crossfire of political tensions as the opposition leader, Sajith Premadasa of the Samagi Jana Balawegaya (SJB), positions himself as a prime ministerial candidate in the upcoming elections. The country’s recent history of absolute majorities, notably in the 1970 and 1977 elections, has led to concerns about potential power imbalances, and analysts like Rajan Philips highlight the critical need for balanced governance. The upcoming elections have set the stage for a new round of political rhetoric, with certain factions seizing on the recent security concerns to criticize the current administration’s handling of safety issues.

The ongoing political maneuvering has exacerbated public concerns, with opposition figures questioning recent police appointments and the government’s response to national security. Cardinal Malcolm Ranjith and the Catholic Church have openly criticized the government’s lack of action regarding the findings from the Presidential Commission of Inquiry into the Easter attacks, further fueling public distrust.

Arugam Bay: The Epicenter of Attention

The media attention surrounding Arugam Bay underscores the extent of the concern. Known for its allure as a surf destination, this coastal area attracts adventure-seeking tourists from across the globe, especially from Israel. Israeli tourists, in particular, have long been drawn to Arugam Bay’s waves, and Israeli media have frequently spotlighted the destination. In fact, a popular Israeli film depicted two soldiers on holiday in Arugam Bay, which introduced many Israeli travelers to the area’s unique charm.

While the surf season at Arugam Bay is nearing its end, stakeholders are worried that the recent security alerts could impact tourist arrivals not only there but also in other southern destinations. With reports of potential threats, it’s uncertain whether Israeli tourists and other international visitors will opt for alternative travel plans, possibly avoiding Sri Lanka altogether in the coming season.

Tourism’s Economic Role and the Ripple Effect of Warnings

Tourism in Sri Lanka does not solely cater to leisure travelers. A recent trend has seen Russians and Ukrainians staying longer in the country, often to avoid military service in their home countries. Some have even established small, informal businesses. The country’s reliance on tourism as a key driver of economic stability means that any drop in tourist numbers could have a domino effect on local communities, particularly in popular destinations such as Ella and Mirissa, known for their vibrant hospitality and adventure tourism sectors.

The current circumstances present Sri Lanka with a challenging conundrum. Reassuring potential tourists about safety is paramount, but the tourism industry also faces the hurdle of convincing international markets that these alerts are based on caution, not necessarily immediate threat. Security measures implemented by the Sri Lankan government aim to maintain a visible presence, but travel advisories carry significant weight in influencing travelers’ decisions.

Looking Ahead: Preparing for the Winter Tourism Season

As the winter season approaches, many in the industry are left wondering about the outlook for Sri Lankan tourism. While the country has shown resilience in rebounding from past challenges, this recent spate of warnings underscores the need for proactive measures in building long-term confidence. Stakeholders suggest that consistent communication from tourism authorities and collaboration with international agencies could play a crucial role in mitigating the fallout from these advisories.

The upcoming parliamentary elections will also serve as a pivotal moment, potentially impacting Sri Lanka’s image and tourism policy. With campaigns in full swing, it remains to be seen if a stable political outcome will offer a respite to a tourism industry striving for stability.

A Resilient Tourism Sector

Despite the challenges, Sri Lanka’s tourism sector has a history of bouncing back. The resilience of its people, combined with the natural beauty of destinations like Arugam Bay, Ella, and Mirissa, has consistently drawn visitors back. While travel advisories may slow momentum in the short term, the country’s rich cultural heritage, diverse landscapes, and warm hospitality continue to appeal to travelers worldwide. As Sri Lanka moves forward, its tourism industry remains hopeful for a prosperous winter season, driven by the efforts of dedicated local businesses and government initiatives aimed at ensuring safety and stability.

As the world watches Sri Lanka navigate this new challenge, its tourism industry stands as a testament to the country’s enduring appeal. The sector’s ability to overcome crises—whether political, economic, or security-related—offers a glimmer of hope for the future, even as it faces one of its most critical tests yet."
1027,2024-10-27 07:39:16,Opening In 2025: Universal Helios Grand Hotel Offers Elegance And Adventure At Epic Universe,https://www.travelandtourworld.com/news/article/opening-in-2025-universal-helios-grand-hotel-offers-elegance-and-adventure-at-epic-universe/,Tourism,"Opening In 2025: Universal Helios Grand Hotel Offers Elegance And Adventure At Epic Universe

The Universal Helios Grand Hotel opens in 2025, offering a Mediterranean-inspired retreat with luxury and adventure at Universal’s Epic Universe theme park.

The upcoming Universal Helios Grand Hotel, part of the Loews Hotels & Co portfolio, promises to be a remarkable addition to Universal’s Epic Universe theme park, opening in 2025. This luxurious 500-room resort, crafted by the acclaimed Universal Creative team, will offer guests an extraordinary escape in the heart of the new theme park. Inspired by Mediterranean aesthetics, the hotel will stand majestically amidst the lush landscapes and serene waters of Celestial Park, becoming a premier destination for travelers seeking elegance and adventure.

The architectural design of Universal Helios Grand Hotel reflects a harmonious blend of sophistication and immersion, where each element is curated to enhance guests’ relaxation and enjoyment. From lavish rooms that cater to peaceful rest to a selection of vibrant amenities, the hotel is crafted for families and individuals alike. Visitors can explore engaging spaces designed to entertain all ages, creating an experience that extends far beyond a typical hotel stay.

Dining at the Universal Helios Grand Hotel promises to be an exquisite experience, with diverse culinary offerings that celebrate flavors from around the world. Guests will have access to a range of fine dining options and casual eateries, each offering unique menus tailored to satisfy a variety of tastes. Among the hotel’s standout features is its rooftop bar, which provides breathtaking views of the surrounding gardens and theme park, making it an ideal spot to unwind after a day of exploration.

One of the most appealing aspects of this resort is its exclusive access to Universal’s Epic Universe. Guests staying at the hotel can enjoy a dedicated entrance to the theme park, making it convenient and effortless to transition from the comfort of their rooms to the excitement of Epic Universe’s attractions. This unique feature ensures a seamless connection between relaxation and adventure, offering visitors a truly immersive vacation experience.

As anticipation builds for its 2025 debut, Universal Helios Grand Hotel stands as a beacon of luxury and innovation in the hospitality industry. With its Mediterranean-inspired ambiance, world-class amenities, and direct access to one of the world’s most exciting new theme parks, this Loews Hotel property is set to redefine the standards of resort experiences, promising an unforgettable stay for every guest."
