download_date,published_date_gmt,title,url,category,raw_text
1031,2024-10-31 14:23:00,Milestone Reached: Foundation Poured for SPC Zach Parker's Accessible Home at Republic Grand Ranch,https://www.benzinga.com/pressreleases/24/10/n41655775/milestone-reached-foundation-poured-for-spc-zach-parkers-accessible-home-at-republic-grand-ranch,Business,"HOUSTON, Oct. 31, 2024 /PRNewswire/ -- A significant milestone has been reached in the construction of the home for triple amputee and retired Army Specialist Zach Parker. On a beautiful morning at Republic Grand Ranch , the foundation was poured for the Parker family's future home, marking an exciting step in this project. The home is being custom-built by Design Tech Homes , with support from the Helping A Hero initiative and generous donations from key partners in the construction industry.

The foundation pour was made possible through the contributions of Keystone, Heidelberg, and Builders Post Tension, whose generosity and commitment have helped make this home a reality for a well-deserving hero. The home is part of the Bass Pro Shops 100 Homes Challenge, which provides custom-built, fully accessible homes to wounded veterans like SPC Zach Parker.

""We spent the day touring the property with Zac and his family, determined to find the perfect homesite. It was a special moment to see this family's vision coming to life at the foundation pour,"" said Gary Sumner, managing partner of Patten Properties.

The home is situated on a beautiful two-acre lot within Republic Grand Ranch, intentionally selected to offer the Parker family privacy and access to nature. The custom home, crafted by Design Tech Homes, will be fully wheelchair accessible, allowing Zach to navigate his daily activities with ease and comfort.

As the project progresses, the Parker family and the entire community look forward to many more milestones, from framing to interior design, and ultimately, move-in day.

""We are truly honored to partner with Republic Grand Ranch, Patten Companies , Helping A Hero, and all the generous donors who helped make this home a reality. It's incredible to see what a community can achieve when we come together for such a meaningful cause!"" - Design Tech Homes

Stay tuned for more updates as we continue building this home for a true American hero. Follow here: IG , FB , LinkedIn & Republic Grand Ranch

About Patten Properties

Patten Properties and its partners are recognized as being among the industry's foremost authorities on real estate investment and development across the nation. Our culture is founded on integrity and professionalism, which we proudly combine with a commitment to creating value and opportunity in today's exciting real estate environment.

CONTACT:

Heather Robison

heather@pattenco.com

View original content to download multimedia:https://www.prnewswire.com/news-releases/milestone-reached-foundation-poured-for-spc-zach-parkers-accessible-home-at-republic-grand-ranch-302293050.html

SOURCE Patten Properties"
1031,2024-10-31 14:22:54,Google News,https://news.google.com/rss/articles/CBMiugFBVV95cUxOejFyV0g2MjA0TGxuSDE3dWJWRUlnaGJGdENFLUthTlZJVFc1X3d1elhSYTFmTWQ5eDgwZzV4NmhRQ1FQcFpMVUJENjJQYVU1OWdBX0ZJRlZUekxySjdCZUJKSU43eTJKSkpDUDR2T1VQWHV4QXJXWHhQT0tlcTJvWnpQOFVlaWFWSU1lRWViSHV6WVpETXRCVnE5SnZtWXpPU0ZUZEJmOTBnQ29UbkFRcDk1V3NPa1lZRGfSAVZBVV95cUxQOXpuR3hHdGRzRlhrXzZpVUs5SnZLMVJFekFwNHE1dTdGUEplR0d1N0dmd3dOSERSWDJFdEFRNmlyYnBhUkxIQl9Jdk1pSHpWaVBkdXNiZw?oc=5,Business,
1031,2024-10-31 14:22:31,S&P Global Market Intelligence partners with MarketAxess,https://www.assetservicingtimes.com/assetservicesnews/industryarticle.php?article_id=16061,Business,"S&P Global Market Intelligence and MarketAxess have entered into a strategic data partnership that is said to result in increased transparency for fixed income markets.



This partnership will see the integration of S&P Global Bond Reference Data into MarketAxess’ data products, as well as the introduction of MarketAxess CP+ into S&P Global’s Evaluated Bond Pricing.



Combining this data from both companies aims to enhance price discovery and transaction cost analysis for clients, as well as result in more consistent pricing and efficiencies across the trade lifecycle.



Commenting on the partnership, Laura Misher, vice president at S&P Global Market Intelligence, states: ""We are excited about this collaboration as it connects a market-leading institutional trading platform with a leading data provider, bringing transparency and consistency in data used across the different functions of our customers.”



Global head of data and ETF solutions at MarketAxess, Kat Sweeney, adds: “Incorporating CP+ into S&P Global’s Evaluated Bond Pricing service will enable our firms to close the gaps between best execution, intraday trading decisions and end-of-day valuation.”



The data integration is expected to commence in Q1 2025.



Next industry article →



Cadent Gas picks Northern Trust as custodian"
1031,2024-10-31 14:22:00,Google News,https://news.google.com/rss/articles/CBMitwFBVV95cUxObXV2aUkzalpjQ2YxWHdrdlQ4OXJkbHpIMXFkWWFBUG5TbXdHeDA2T2NWNU9LTklic0pfRGp3NlF5TExUS0l6MEFPRTMzcDFnMTByTnRxSWdZNExDemtISDZ0VjI2aG1KOWxIS0piWTFCUlVRSzR0V3c1ZnZQOElNMEwtRXlzM1VqZUNnT2dQMjFiVEw5WnJmTjNmR01MdnZqRXVOTmJqWFJYQUt6c0VtODdmSUhFV1HSAbwBQVVfeXFMTmJoM3ZnX29FWHQwMkdwSjhOZFgzT1ZRWmN5bnZacUg0UUtiMmFSQVk1WHVfamY0bFVsczdMdDRRYXBmTUdIdDQ0ZmRoUVRtWjVJdndhWDNoR2NGa1oyTkdrN3VEYXE3dVo2dVlzd3JCSUR2dUZ5YTlGVjRyNmVhcHNBOUcxdWREa1BJUzJGak1GQ2JRT2dQbFc2b2o4U2twLUJoZGhRR3Y1M3pZRHBYcHNkVE9aU18wZHdkdG4?oc=5,Business,
1031,2024-10-31 14:21:00,Delska Celebrates a Topping Out Ceremony for the Most Sustainable Data Center in the Baltics,https://www.benzinga.com/pressreleases/24/10/n41655689/delska-celebrates-a-topping-out-ceremony-for-the-most-sustainable-data-center-in-the-baltics,Business,"RIGA, Latvia, Oct. 31, 2024 /PRNewswire/ -- On 28 October, Delska celebrated a significant construction milestone—the Topping-out event—for its upcoming Tier III-certified, 10 MW data center in Riga. As one of only 20 LEED-certified buildings in Latvia, the data center will set new standards for green construction and energy efficiency in the Baltic region. The project is planned to be launched in August 2025.

With over €30 million invested, the carrier-neutral 10 MW data center will offer a full range of IT and network solutions and house up to 1,000 racks. The 6,000-square-meter facility is designed for scalability, with potential expansion up to 30 MW, making it ideal for hyperscalers, AI, and high-power computing needs.

The new data center reached its highest point, and the topping-out ceremony was well attended by the Latvian Speaker of the Parliament Daiga Mierina, the Minister of Climate and Energy Kaspars Melnis, the Minister of Smart Administration and Regional Development Inga Berzina, as well as Member of the Riga City Council and leaders of associations. They highlighted the project as a great example of sustainable business planning, its importance for the growth of the Latvian economy, the IT industry's export potential, and global competitiveness.

Due to Delska's goal of achieving net zero CO2 by 2030, the data center will be entirely powered by green energy and rely on backup generators using Neste MY diesel, produced from renewables. Additionally, the facility will be equipped with an energy-efficient and innovative Vindur® CoolW@ll cooling system. The data center will operate at a power usage effectiveness (PUE) under 1.3.

""With the establishment of this data center, we are fully prepared to deliver the required space and power capacity, especially when power-demanding AI tools have seen a significant increase and Europe is lacking required power and data center capacity,"" explains Andris Gailitis, the CEO of Delska.

The growing demand for Internet of Things solutions, digital transformation, and cloud services drives data consumption like never before. Smart homes, video streaming platforms, and artificial intelligence tools rely on data centers' ability to deliver content to users worldwide without delay. Companies want to expand their operations without significant investments in maintaining their IT infrastructure.

Delska plans to build another data center in Lithuania and expand its group of companies to create a comprehensive regional data center and network ecosystem.

About Delska

Delska is a carrier-neutral data center and network provider in Northern Europe with 25 years of experience, delivering reliable, personalized IT and network solutions to meet customers' business needs. It has two primarily owned locations in Riga and Vilnius and points of presence in Frankfurt, Amsterdam, and Stockholm.

Since June 2024, the new brand Delska has united two companies—DEAC European Data Center and Data Logistics Center (DLC)—which operate under their legal entities, owned by Quaero European Infrastructure Fund II and managed by Quaero Capital.

www.delska.com

Photo - https://mma.prnewswire.com/media/2545980/Delska_Data_Center.jpg

Logo - https://mma.prnewswire.com/media/2545981/Delska_Logo.jpg

View original content to download multimedia:https://www.prnewswire.com/news-releases/delska-celebrates-a-topping-out-ceremony-for-the-most-sustainable-data-center-in-the-baltics-302293047.html

SOURCE Delska"
1031,2024-10-31 14:20:30,Trump Vs. Harris: Who Are Whales Betting On And Who's The Favorite Of Smaller Bettors?,https://www.benzinga.com/markets/cryptocurrency/24/10/41655616/trump-vs-harris-who-are-whales-betting-on-and-whos-the-favorite-of-smaller-bettors,Top,"In the race for the U.S. presidency, a stark contrast emerges on Polymarket as the distribution of Donald Trump and Kamala Harris shares highlights distinct economic philosophies that mirror each candidate's policies.

What Happened: According to data from Primo Data and Polymarketanalytics, the ownership concentration reveals two markedly different supporter profiles, with Trump's largest backers consolidating a majority of the shares, while Kamala's supporters appear more diverse and evenly distributed.

Trump's ""Yes"" shares on Polymarket show that five major accounts hold 50% of the total 162 million shares—an estimated $81 million in payouts should he win.

The largest of these accounts, dubbed ""Le Giga Whale,"" holds nearly a third of these shares alone, underscoring a heavily concentrated backing that mirrors Trump's strong appeal to high-net-worth investors and large stakeholders.

Also Read: Bitcoin White Paper Turns 16 On Halloween—Don’t Let Its Price Increase Since 2010 Spook You

Conversely, Kamala's ""Yes"" shares tell a different story.

The top five holders account for only 18% of shares, with no individual holding exceeding 5%.

This broad ownership reflects a decentralized base, aligning with her policy stance focused on appealing to a broader cross-section of the population.

The divide becomes even more apparent when considering the popular vote on Polymarket. Trump's top backers—led once again by ""Monsieur Whale""—command 82% of ""Yes"" shares, setting the stage for a potential $36 million payout if he secures the popular vote.

Kamala's top five backers, by contrast, hold only 25% of the vote's total shares. Notably, Polymarket's biggest all-time loser, ""therealbatman,"" has taken the top spot among those betting on Kamala for the popular vote.

What’s Next: As the election approaches, market watchers will have a closer look at the Benzinga Future of Digital Assets event on Nov. 19, where industry experts will discuss the evolving landscape of digital assets and prediction markets in politics.

Read Next:

Image: Shutterstock"
1031,2024-10-31 14:18:25,AP Sports SummaryBrief at 10:00 p.m. EDT,https://www.yakimaherald.com/ap/sports/ap-sports-summarybrief-at-10-18-a-m-edt/article_cf669fab-bc0e-511a-88c3-9830c6a089b5.html,Education,"Copyright 2024 The Associated Press. All rights reserved. This material may not be published, broadcast, rewritten or redistributed."
1031,2024-10-31 14:08:55,PHOTO COLLECTION: World Series Reax,https://www.yakimaherald.com/news/nation_and_world/nation/photo-collection-world-series-reax/article_f7cfaed0-284f-57f0-88f0-d67eed5de01f.html,Education,"Copyright 2024 The Associated Press. All rights reserved. This material may not be published, broadcast, rewritten or redistributed without permission."
1031,2024-10-31 14:01:06,Google Maps adds AI features to help users explore and navigate the world around them,https://www.yakimaherald.com/news/nation_and_world/business/google-maps-adds-ai-features-to-help-users-explore-and-navigate-the-world-around-them/article_218f64bf-4a06-534b-9659-f6a31f69949c.html,Education,"Copyright 2024 The Associated Press. All rights reserved. This material may not be published, broadcast, rewritten or redistributed without permission."
1031,2024-10-31 14:00:00,Downingtown Area School District Honors Cultural Diversity with Indian and Native American Heritage Month Celebrations,https://www.mychesco.com/a/education/school-districts/downingtown-sd/downingtown-area-school-district-honors-cultural-diversity-with-indian-and-native-american-heritage-month-celebrations/,Education,"Bradford Heights Elementary students gather in celebration of Indian Heritage Month, kicking off a month of activities across DASD that honor the contributions of the Indian community. /Submitted Image

DOWNINGTOWN, PA — As part of its unwavering dedication to promoting diversity and inclusivity, the Downingtown Area School District (DASD) has initiated its annual observance of Indian Heritage Month and Native American Heritage Month. These celebrations, which began on October 25 at Bradford Heights Elementary School, are set to continue across the district throughout November.

While Indian Heritage Month lacks federal recognition, DASD emphasizes its importance by acknowledging the achievements and contributions of South Asians both in the United States and globally. This recognition is particularly significant given that the Asian community constitutes the largest minority group within the district, with Upper Uwchlan Township being home to one of Pennsylvania’s most substantial Asian populations.

Justin Brown, the district’s Director of Diversity, Equity, and Inclusion, highlighted the vital role of acknowledging the contributions of South Asians in American history. He remarked, “It’s always important to recognize the often-overlooked achievements of South Asians in every field throughout our nation’s past.” This statement underscores DASD’s commitment to fostering an understanding and appreciation of diverse cultural histories within its educational framework.

Throughout November, DASD schools have organized a series of activities designed to engage students, parents, and community members in celebrating Indian and Native American cultures. These events offer opportunities to explore and appreciate cultural heritage through music, cuisine, and traditional customs, thereby enriching the community’s cultural understanding and unity.

By celebrating these heritage months, DASD not only honors the diverse backgrounds of its students and families but also reinforces its commitment to inclusivity and cultural appreciation. These efforts reflect the district’s broader mission to create an educational environment where diversity is celebrated and every student feels valued and represented.

For the latest news on everything happening in Chester County and the surrounding area, be sure to follow MyChesCo on Google News and MSN.

Share this: Facebook

LinkedIn

Twitter

Reddit

Pinterest

Email

Print

More

Tumblr

Pocket

Telegram

WhatsApp

"
1031,2024-10-31 14:00:00,Lower Columbia College debate team wins third place,https://tdn.com/news/local/education/lower-columbia-college-debate-team-wins-third-place/article_ae14b87e-961a-11ef-b7d7-b7b72f4736e6.html,Education,"The Lower Columbia College Fighting Smelt Speech and Debate Team won third place in overall team sweepstakes and placed first among community colleges at the recent Clark and Rae Peters Invitational tournament.

The college placed above several four-year schools including Oregon State University, Whitman College and Lewis & Clark College.

Second year LCC student My Ta advanced to final rounds in all four of her events. She was tournament champion in editorial commentary, third place in novice impromptu speaking and fifth place and top novice in persuasive speaking. She also won bronze in novice IPDA debate.

Keidustine Glidden was tournament champion in poetry interpretation, second place in persuasive speaking and third place in editorial commentary.

Mara Slabu was tournament champion in novice impromptu speaking, second place speaker in novice IPDA debate and third place in novice extemporaneous speaking. Seamus Mahoney was fourth place in extemporaneous speaking and fifth place in editorial commentary.

Haylee Norris finished fourth in editorial commentary. This was her first intercollegiate speech and debate tournament.

Next, the team is scheduled to attend the Mahaffey Memorial Tournament hosted by Linfield University Nov. 15 to 17. This will be the second Northwest Forensics Conference Designated Tournament of the season."
1031,2024-10-31 13:46:31,Lindsay Unified superintendent retiring after 23 years,https://abc30.com/post/lindsay-unified-superintendent-retiring-after-23-years/15492300/,Education,"Lindsay Unified superintendent retiring after 23 years

Lindsay Unified announced their superintendent, Tom Rooney, is retiring after 23 years.

Lindsay Unified superintendent retiring after 23 years Lindsay Unified announced their superintendent, Tom Rooney, is retiring after 23 years.

Lindsay Unified superintendent retiring after 23 years Lindsay Unified announced their superintendent, Tom Rooney, is retiring after 23 years.

Lindsay Unified superintendent retiring after 23 years Lindsay Unified announced their superintendent, Tom Rooney, is retiring after 23 years.

LINDSAY, Calif. (KFSN) -- Lindsay Unified announced their superintendent, Tom Rooney, is retiring after 23 years.

Rooney has worked as a principal and superintendent.

He says he is most proud of building a performance-based educational system and the ""Lindsay Transformational Story.""

It has allowed students to learn at their own pace and in different ways.

""I want to say thank you to the Lindsay staff, to the Lindsay school board and to the Lindsay community for giving me the opportunity to serve and be part of this incredible journey to advance the life of Lindsay learners,"" he said. ""You will forever be in my heart and in my mind.""

Rooney plans to spend more time with his family, traveling and continuing to work alongside the Lindsay Education Foundation.

His last day as superintendent will be in January.

"
1031,2024-10-31 13:30:00,"Limburg named TSSAA Softball Coach of the Year, honored in proclamation",https://www.clevelandbanner.com/news/limburg-named-tssaa-softball-coach-of-the-year-honored-in-proclamation/article_412d0c5d-5e70-58af-88c1-2632d346ce66.html,Education,"Cleveland, TN (37311)

Today

Showers this evening, becoming a steady rain overnight. Low 64F. Winds light and variable. Chance of rain 100%. Rainfall near a quarter of an inch..

Tonight

Showers this evening, becoming a steady rain overnight. Low 64F. Winds light and variable. Chance of rain 100%. Rainfall near a quarter of an inch."
1031,2024-10-31 13:02:05,The struggle for Senate control goes down to the wire as spending shatters records,https://www.yakimaherald.com/news/nation_and_world/nation/the-struggle-for-senate-control-goes-down-to-the-wire-as-spending-shatters-records/article_9eb3c695-f8a3-5af9-9850-972ec508497d.html,Education,"The struggle for Senate control goes down to the wire as spending shatters records

Billions of dollars in ads are raining down on voters across the Rust Belt, Rocky Mountains and American southwest as the two major political parties struggle for control of the U.S. Senate"
1031,2024-10-31 13:00:00,"Lovingood to resign from county BOE, pursuing new ministry opportunity in AL",https://www.clevelandbanner.com/news/lovingood-to-resign-from-county-boe-pursuing-new-ministry-opportunity-in-al/article_9500f1bc-89ff-5267-b051-867fb5aebc8e.html,Education,"Cleveland, TN (37311)

Today

Showers this evening, becoming a steady rain overnight. Low 64F. Winds light and variable. Chance of rain 100%. Rainfall near a quarter of an inch..

Tonight

Showers this evening, becoming a steady rain overnight. Low 64F. Winds light and variable. Chance of rain 100%. Rainfall near a quarter of an inch."
1031,2024-10-31 12:36:00,Granite Falls schools placed on lockdown. Report of threat found to be false,https://hickoryrecord.com/news/local/education/granite-falls-schools-placed-on-lockdown-report-of-threat-found-to-be-false-caldwell-county-north-carolina/article_1c8495b2-9784-11ef-aae6-db35f45eff08.html,Education,"A fake threat against South Caldwell High School placed schools in Granite Falls on lockdown on Thursday morning.

From the Caldwell County Schools Facebook page:

""Schools in the Granite Falls area were on lockdown this morning due to a community threat. The threat was found to be a false report. There was no immediate threat to schools. The lockdown was performed out of an abundance of caution.""

Caldwell County Sheriff Kevin Bean said the Caldwell County Communications Center received a call shortly before 7:30 a.m. on Thursday. The caller reported a possible threat towards South Caldwell High School.

As a result, South Caldwell High School and all other schools in Granite Falls were placed on a temporary lockdown. South Caldwell High School is located at 7035 Spartan Drive.

Bean said multiple agencies investigated the threat and determined it was false.

As of 9:45 a.m., the lockdowns have been lifted and all schools are operating on a regular schedule."
1029,2024-10-29 08:52:03,Who Killed Sazz in Only Murders in the Building Season 4?,https://www.comingsoon.net/guides/news/1871053-only-murders-in-the-building-season-4-who-killed-sazz-killer-omitb-finale,Entertainment,"Curiosity is high about who killed Sazz in Only Murders in the Building Season 4. As the thrilling finale unfolds, the thriller comedy series finally solved Sazz’s murder mystery which was the central plot of this season. This shocking revelation not only exposes the killer but also the dark motives behind the murder.

So, who killed Sazz and what was the reason behind it? Here is everything you need to know about this startling revelation in the series.

Who is Sazz’s killer in Only Murders in the Building Season 4

Marshall Pope killed Sazz Pataki in Season 4 of the show.

In the final episode, the trio of Mabel, Oliver, and Charles are close to unveiling the mystery behind Sazz’s murder. Finally, Mabel connects the dots and realizes Marshall is the killer who was also Sazz’s protégé. Eventually, Marshall confesses, admitting not only to Sazz’s murder but also to killing Glen to protect his secret.

Marshall planned to eliminate Mabel next. However, the young detective manages to distract his attention by pointing out the loopholes in his script. On the other hand, Charles realizes that he can use the ledge of Vince’s house to sneak into the apartment to save Mabel. Marshall used a similar way to carry out his plan by sneaking through the apartment’s window.

Charles and Oliver manage to make it on time with the help of Vince and Rudy. Charles manages to disarm Marshall and the trio questions his motive behind the murder.

Why did Marshall kill Sazz in Only Murders in the Building Season 4?

Marshall killed Sazz to save his career.

Marshall revealed how Sazz offered to read his screenplay while showing her own script for Only Murders film. He ended up feeling jealous that Sazz’s script was better than him. As such, he stole the script and the film got fast-tracked after he made some alterations. Sazz confronted Marshall about his crime and he decided to kill her to save his career. He killed her with the help of a sniper rifle and stunt training.

Only Murders in the Building Season 4 is streaming on Hulu."
1029,2024-10-29 08:51:38,Palestinian official says the death toll from an Israeli strike on northern Gaza has climbed to 60,https://www.newspressnow.com/news/world_news/palestinian-official-says-the-death-toll-from-an-israeli-strike-on-northern-gaza-has-climbed/article_31a4b850-6b4e-5557-b117-dee9eb84adbd.html,Entertainment,"State Alabama Alaska Arizona Arkansas California Colorado Connecticut Delaware Florida Georgia Hawaii Idaho Illinois Indiana Iowa Kansas Kentucky Louisiana Maine Maryland Massachusetts Michigan Minnesota Mississippi Missouri Montana Nebraska Nevada New Hampshire New Jersey New Mexico New York North Carolina North Dakota Ohio Oklahoma Oregon Pennsylvania Rhode Island South Carolina South Dakota Tennessee Texas Utah Vermont Virginia Washington Washington D.C. West Virginia Wisconsin Wyoming Puerto Rico US Virgin Islands Armed Forces Americas Armed Forces Pacific Armed Forces Europe Northern Mariana Islands Marshall Islands American Samoa Federated States of Micronesia Guam Palau Alberta, Canada British Columbia, Canada Manitoba, Canada New Brunswick, Canada Newfoundland, Canada Nova Scotia, Canada Northwest Territories, Canada Nunavut, Canada Ontario, Canada Prince Edward Island, Canada Quebec, Canada Saskatchewan, Canada Yukon Territory, Canada

Zip Code"
