download_date,published_date_gmt,title,url,category,raw_text
1028,2024-10-28 01:05:46,McDonald's to resume selling Quarter Pounders after beef patties test negative for E. coli,https://abc7news.com/post/mcdonalds-coli-outbreak-testing-rules-beef-patties-source-quarter-pounders-food-poisoning-cases-company-says/15478170/,Health,"However, Quarter Pounders will no have slivered onions, the company said

McDonald's announced Sunday that testing has ruled out beef patties as the source of an E. coli outbreak linked to Quarter Pounders.

Beef patties ruled out as source of E. coli outbreak, McDonald's says McDonald's announced Sunday that testing has ruled out beef patties as the source of an E. coli outbreak linked to Quarter Pounders.

Beef patties ruled out as source of E. coli outbreak, McDonald's says McDonald's announced Sunday that testing has ruled out beef patties as the source of an E. coli outbreak linked to Quarter Pounders.

Beef patties ruled out as source of E. coli outbreak, McDonald's says McDonald's announced Sunday that testing has ruled out beef patties as the source of an E. coli outbreak linked to Quarter Pounders.

LOS ANGELES -- McDonald's will resume selling Quarter Pounders in all restaurants in the coming week after considering new data regarding an E. coli outbreak linked to its famed burgers, the company announced Sunday.

The US Centers for Disease Control and Prevention issued a food safety alert Tuesday warning dozens of people reported eating the Quarter Pounder sandwich at McDonald's before becoming sick.

The E. coli outbreak has led to 75 illness across 13 states, including 22 hospitalizations and one death, according to the latest information from the CDC, with most of the related illnesses occurring in Colorado.

A specific ingredient has not been confirmed as the source of the outbreak, federal agencies said Friday, but the US Food and Drug Administration previously said the slivered onions or beef patties on Quarter Pounder sandwiches are the likely source of contamination.

On Sunday, the Colorado Department of Agriculture said McDonald's beef patties used for the Quarter Pounder tested negative for E. coli. The department tested fresh patties from restaurants associated with the outbreak.

Based on the findings from the Colorado agriculture department and after comparing CDC data with its own supply chain data, McDonald's is confident in ruling out fresh beef patties as a source of contamination, according to a Sunday news release.

RELATED: McDonald's and Boar's Head outbreaks may have you worried. Experts say the food supply is safe

The company is now asking beef suppliers to produce a new supply of fresh beef patties, and the Quarter Pounder is expected to be available in all restaurants in the coming week, the release said.

The 900 restaurants that received slivered onions from McDonald's supplier Taylor Farms' Colorado Springs facility will resume sales of Quarter Pounders without slivered onions, the release added. ""Those restaurants are in Colorado, Kansas, and Wyoming, as well as portions of Idaho, Iowa, Missouri, Montana, Nebraska, Nevada, New Mexico, Oklahoma, and Utah,"" it said.

The FDA and CDC say they are continuing to work with partners to investigate the source of the outbreak. CNN has reached out to the FDA to see if it has ruled out beef patties as the source of the E. coli outbreak. When contacted by CNN on Sunday, the CDC referred back to its Friday release, which does not specify a specific ingredient as the cause.

""The FDA is using all available tools to confirm if onions are the source of this outbreak,"" a spokesperson said previously. ""FDA and state partners are also collecting onion samples for analysis.""

RELATED: 1st lawsuit filed against McDonald's over its E. coli outbreak

Taylor Farms removed yellow onions from the market ""out of an abundance of caution,"" the company said in a statement Wednesday, and distributor US Foods has issued a recall of four onion products due to ""potential E. coli contamination.""

""I know that our relationship is built on trust,"" McDonald's US President Joe Erlinger said in a video message posted Sunday. ""You trust us to serve you safe food every time.""

""On behalf of the McDonald's system, I want you to hear from me: we are sorry,"" Erlinger added. ""For those customers affected, you have my commitment that, led by our values, we will make this right."""
1028,2024-10-28 01:05:46,McDonald's to resume selling Quarter Pounders after beef patties test negative for E. coli,https://abc13.com/post/mcdonalds-coli-outbreak-testing-rules-beef-patties-source-quarter-pounders-food-poisoning-cases-company-says/15478170/,Health,"However, Quarter Pounders will no have slivered onions, the company said

McDonald's announced Sunday that testing has ruled out beef patties as the source of an E. coli outbreak linked to Quarter Pounders.

Beef patties ruled out as source of E. coli outbreak, McDonald's says McDonald's announced Sunday that testing has ruled out beef patties as the source of an E. coli outbreak linked to Quarter Pounders.

Beef patties ruled out as source of E. coli outbreak, McDonald's says McDonald's announced Sunday that testing has ruled out beef patties as the source of an E. coli outbreak linked to Quarter Pounders.

Beef patties ruled out as source of E. coli outbreak, McDonald's says McDonald's announced Sunday that testing has ruled out beef patties as the source of an E. coli outbreak linked to Quarter Pounders.

LOS ANGELES -- McDonald's will resume selling Quarter Pounders in all restaurants in the coming week after considering new data regarding an E. coli outbreak linked to its famed burgers, the company announced Sunday.

The US Centers for Disease Control and Prevention issued a food safety alert Tuesday warning dozens of people reported eating the Quarter Pounder sandwich at McDonald's before becoming sick.

The E. coli outbreak has led to 75 illness across 13 states, including 22 hospitalizations and one death, according to the latest information from the CDC, with most of the related illnesses occurring in Colorado.

A specific ingredient has not been confirmed as the source of the outbreak, federal agencies said Friday, but the US Food and Drug Administration previously said the slivered onions or beef patties on Quarter Pounder sandwiches are the likely source of contamination.

On Sunday, the Colorado Department of Agriculture said McDonald's beef patties used for the Quarter Pounder tested negative for E. coli. The department tested fresh patties from restaurants associated with the outbreak.

Based on the findings from the Colorado agriculture department and after comparing CDC data with its own supply chain data, McDonald's is confident in ruling out fresh beef patties as a source of contamination, according to a Sunday news release.

RELATED: McDonald's and Boar's Head outbreaks may have you worried. Experts say the food supply is safe

The company is now asking beef suppliers to produce a new supply of fresh beef patties, and the Quarter Pounder is expected to be available in all restaurants in the coming week, the release said.

The 900 restaurants that received slivered onions from McDonald's supplier Taylor Farms' Colorado Springs facility will resume sales of Quarter Pounders without slivered onions, the release added. ""Those restaurants are in Colorado, Kansas, and Wyoming, as well as portions of Idaho, Iowa, Missouri, Montana, Nebraska, Nevada, New Mexico, Oklahoma, and Utah,"" it said.

The FDA and CDC say they are continuing to work with partners to investigate the source of the outbreak. CNN has reached out to the FDA to see if it has ruled out beef patties as the source of the E. coli outbreak. When contacted by CNN on Sunday, the CDC referred back to its Friday release, which does not specify a specific ingredient as the cause.

""The FDA is using all available tools to confirm if onions are the source of this outbreak,"" a spokesperson said previously. ""FDA and state partners are also collecting onion samples for analysis.""

RELATED: 1st lawsuit filed against McDonald's over its E. coli outbreak

Taylor Farms removed yellow onions from the market ""out of an abundance of caution,"" the company said in a statement Wednesday, and distributor US Foods has issued a recall of four onion products due to ""potential E. coli contamination.""

""I know that our relationship is built on trust,"" McDonald's US President Joe Erlinger said in a video message posted Sunday. ""You trust us to serve you safe food every time.""

""On behalf of the McDonald's system, I want you to hear from me: we are sorry,"" Erlinger added. ""For those customers affected, you have my commitment that, led by our values, we will make this right."""
1028,2024-10-28 01:01:30,CORXEL and LENZ Therapeutics Announce Positive Topline Data from China Phase 3 Presbyopia Trial ...,https://www.hastingstribune.com/ap/business/corxel-and-lenz-therapeutics-announce-positive-topline-data-from-china-phase-3-presbyopia-trial/article_ebc865f4-8974-5615-8f66-8a71ba0a0bf8.html,Health,"State Alabama Alaska Arizona Arkansas California Colorado Connecticut Delaware Florida Georgia Hawaii Idaho Illinois Indiana Iowa Kansas Kentucky Louisiana Maine Maryland Massachusetts Michigan Minnesota Mississippi Missouri Montana Nebraska Nevada New Hampshire New Jersey New Mexico New York North Carolina North Dakota Ohio Oklahoma Oregon Pennsylvania Rhode Island South Carolina South Dakota Tennessee Texas Utah Vermont Virginia Washington Washington D.C. West Virginia Wisconsin Wyoming Puerto Rico US Virgin Islands Armed Forces Americas Armed Forces Pacific Armed Forces Europe Northern Mariana Islands Marshall Islands American Samoa Federated States of Micronesia Guam Palau Alberta, Canada British Columbia, Canada Manitoba, Canada New Brunswick, Canada Newfoundland, Canada Nova Scotia, Canada Northwest Territories, Canada Nunavut, Canada Ontario, Canada Prince Edward Island, Canada Quebec, Canada Saskatchewan, Canada Yukon Territory, Canada

Zip Code"
1028,2024-10-28 01:00:59,"Paws N’ Claws Veterinary Surgery in Singapore Recognised for Service Excellence, Trustworthiness, Volunteerism",https://www.hastingstribune.com/ap/health/paws-n-claws-veterinary-surgery-in-singapore-recognised-for-service-excellence-trustworthiness-volunteerism/article_1a0094e0-1c0c-500e-ab06-da2b74dce2a7.html,Health,"State Alabama Alaska Arizona Arkansas California Colorado Connecticut Delaware Florida Georgia Hawaii Idaho Illinois Indiana Iowa Kansas Kentucky Louisiana Maine Maryland Massachusetts Michigan Minnesota Mississippi Missouri Montana Nebraska Nevada New Hampshire New Jersey New Mexico New York North Carolina North Dakota Ohio Oklahoma Oregon Pennsylvania Rhode Island South Carolina South Dakota Tennessee Texas Utah Vermont Virginia Washington Washington D.C. West Virginia Wisconsin Wyoming Puerto Rico US Virgin Islands Armed Forces Americas Armed Forces Pacific Armed Forces Europe Northern Mariana Islands Marshall Islands American Samoa Federated States of Micronesia Guam Palau Alberta, Canada British Columbia, Canada Manitoba, Canada New Brunswick, Canada Newfoundland, Canada Nova Scotia, Canada Northwest Territories, Canada Nunavut, Canada Ontario, Canada Prince Edward Island, Canada Quebec, Canada Saskatchewan, Canada Yukon Territory, Canada

Zip Code"
1028,2024-10-28 01:00:00,MedPro International’s Global Giving Inspires and Supports Future Nurses in the Philippines,https://www.globenewswire.com/news-release/2024/10/28/2969757/0/en/MedPro-International-s-Global-Giving-Inspires-and-Supports-Future-Nurses-in-the-Philippines.html,Health,"SUNRISE, Florida, USA, Oct. 27, 2024 (GLOBE NEWSWIRE) -- The MedPro International and MedProU teams returned from a transformative trip to the Philippines, engaging with future nurses and local healthcare leaders about the profound impact of MedPro International’s Global Giving initiative on healthcare and nursing education. “Recognizing that healthcare sustainability is a pressing global concern, through Global Giving, MedPro International is committed to fostering enduring relationships to address the unique healthcare needs of local communities around the world and nurture the next generation of healthcare professionals,” said MedPro International Executive Vice President of International Operations Patty Jeffrey, RN.

At the prestigious 57th Annual ANSAP Convention, sponsored by MedPro International, Senior Manager of International Testing Joely Carrillo addressed an audience of 1,100 healthcare leaders on efforts to educate nurses and develop healthcare in local communities while also speaking on the importance of prioritizing physical, mental, and emotional well-being. During the two-week visit, Carrillo also hosted five nursing seminars focused on Global Giving’s educational initiatives, engaging primarily with fourth-year nursing students. “It was an incredible experience,” Carrillo stated. Her lectures provided practical strategies for managing test anxiety, emphasizing that the right tools can significantly enhance performance. In addition to in-person instruction, students benefited from recorded lectures from MedProU’s web-based series.

Carrillo also gained valuable insights into the challenges faced by nursing students, particularly regarding limited internet access, which affects their educational resources. “Internet access is crucial,” she explained. “This visit has highlighted the need for alternative approaches to education that can adapt to these challenges.” Carrillo also toured Perpetual Help Medical Center in Las Piñas, a partner in MedPro’s Global Giving events.

Global Giving

These recent initiatives follow MedPro International’s sponsorship of medical services for over 300 patients at a one-day event in Loma, Biñan City, Philippines, last summer. This event provided vital screenings, cardiac EKG tests, x-rays, and doctor consultations.

Additionally, MedPro participated in “Brigada Eskwela 2023” in Las Piñas City, visiting two elementary schools to donate supplies and help clean classrooms, repaint walls, and refurbish furniture. The MedPro International team plans to return to the Philippines to provide additional instruction to students in early 2025.

About MedPro International

Since 2006, MedPro International has prepared and deployed more foreign-educated healthcare professionals in the United States than any other U.S. staffing company. As a member of the American Association of International Healthcare Recruitment (AAIHR), MedPro International subscribes to the AAIHR code of ethics, which ensures the ethical treatment of foreign-educated healthcare professionals through full support sponsorship. MedPro handles all costs and aspects of immigration, licensing, credentialing, testing, clinical and U.S. assimilation training, and education to ensure healthcare workers successfully transition into the U.S. healthcare system.

To find out more, go to https://www.medprointernational.com/apply/ to complete a brief application, and a Recruiter will contact you right away! Or you can call us at 954.739.4247.

Attachments"
1028,2024-10-28 00:59:00,"McDonald's beef patties test negative for E. coli in Colorado, Department of Agriculture says",https://www.cbsnews.com/colorado/news/mcdonalds-beef-patties-test-negative-for-e-coli-in-colorado-department-of-agriculture-says/,Health,"Colorado has seemingly eliminated one ingredient as a cause for death and illness, as states continue to investigate the source of an E. coli outbreak involving the Quarter Pounder hamburger at dozens of McDonald's locations. As a result, the Quarter Pounder will begin to return to certain locations.

The Colorado Department of Agriculture announced McDonald's brand ""fresh and frozen beef patties"" tested negative for E. coli after its lab analyzed dozens of subsamples.

CDA says it has completed all beef testing and does not anticipate receiving further samples.

Meanwhile, the federal investigation into the deadly E. coli outbreak in Colorado has focused on ground beef patties and onions. There continues to be no evidence that onions grown in Colorado are linked to the outbreak.

According to McDonald's, The 900 restaurants that historically received slivered onions from Taylor Farms' Colorado Springs facility will resume sales of Quarter Pounders without slivered onions. Those restaurants are in Colorado, Kansas, and Wyoming, as well as portions of Idaho, Iowa, Missouri, Montana, Nebraska, Nevada, New Mexico, Oklahoma and Utah. The restaurant chain also noted it has stopped getting onions from that facility indefinitely.

""The issue appears to be contained to a particular ingredient and geography, and we remain very confident that any contaminated product related to this outbreak has been removed from our supply chain and is out of all McDonald's restaurants,"" McDonald's North American Chief Supply Chain Officer Cesar Piña said in a statement Sunday

Since the outbreak was first announced, CBS News Colorado confirmed one older man on the Western Slope died after consuming a Quarter Pounder from a McDonald's location in the state. Initial information also confirmed more than two dozen people had become ill due to E. coli-affected Quarter Pounders.

Nationwide, this outbreak has sickened 75 people in more than a dozen states, but Colorado remains the only state impacted that has experienced a death due to it.

The Colorado Department of Public Health says there have been 26 cases reported in nine different Colorado counties, and they are located in several different parts of the state:

Arapahoe County

Chaffee County

El Paso County

Gunnison County

Larimer County

Mesa County

Routt County

Teller County

Weld County

The illnesses were reported between the last days of September and through Oct. 11. An investigation by the Centers for Disease Control and Prevention into the outbreak is ongoing.

McDonald's company leaders previously said they've taken Quarter Pounders off the menu in states where there have been outbreaks."
1029,2024-10-29 08:51:56,Novartis CEO on the impact of the U.S. election for pharma,https://www.cnbc.com/video/2024/10/29/novartis-ceo-on-the-impact-of-the-u-s-election-for-pharma.html,Health,"Share Share Article via Facebook Share Article via Twitter Share Article via LinkedIn Share Article via Email

Novartis CEO on the impact of the U.S. election for pharma

Novartis CEO Vas Narasimhan talks to CNBC about the company's latest results and the potential impact of the U.S. election on the business."
1029,2024-10-29 08:49:32,Creating A Healthy Diet Menu,https://www.recentlyheard.com/creating-a-healthy-diet-menu/,Health,"Creator

Josef Bichler

Revealed

July 3, 2015

Phrase depend

529

Whether or not you are attempting to reduce weight, cleanse your system or simply lead a more healthy life-style, selecting the best nutritious diet menu is crucial for all of this stuff. Contemplating pure meals, natural meals, and consuming extra fruits and veggies every day, are among the issues that it’s important to take into account when making an attempt to eat more healthy. No matter your targets, you can find that with a nutritious diet menu not solely will you look higher, however you’re additionally going to really feel more healthy, have extra vitality all through the day, and really feel higher about your self and your look.

With the intention to cleanse the system, a detox weight-reduction plan plan is a good way to begin the more healthy consuming life-style. You need to use an all liquid weight-reduction plan, the place you mix vegatables and fruits, as a way to assist with the detox, and assist to eliminate the toxins in your physique. Since you’re consuming so few energy every day, you do must restrict this section of the weight-reduction plan to at least one to 2 weeks at most. However, throughout this era you’ll get rid of all impurities within the physique, making it simpler to ultimately attain a wholesome weight, and the best physique picture.

After a liquid detox, you can begin to include meals in to your nutritious diet menu and consuming plan. Beginning to embrace entire meals, excessive protein meals, and more healthy meal choices, are some issues to think about. Throughout the incorporation section of the nutritious diet menu you need to nonetheless hold out meals which can be excessive in toxins (processed meals, pre-packaged meals, alcohol, candies, and so on). In doing so, you will accumulate a more healthy consuming type, be taught which meals you may eat, and what you need to keep away from, and you’re nonetheless going to flush away the impurities from the weight-reduction plan you have been beforehand on.

When re-introducing meals to your daily routine you’ve to take action slowly. Subsequently, when getting in to a nutritious diet menu and consuming plan you need to use meal replacements, and protein shakes. These meals are excessive in protein, and are going to assist hold you full, whereas protecting the calorie consumption right down to a minimal. This permits your physique to course of meals naturally, and you will discover it a lot simpler to be taught the correct consuming types and habits when you find yourself making fewer meals by yourself every day.

It doesn’t matter what your final targets are, a nutritious diet menu will incorporate numerous meals teams after getting re-introduced all meals in to the weight-reduction plan. It is best to take into account excessive protein diets, decrease carbs, and low fats diets. That is going to make for the best mix of meals wanted within the system, and it’s going to assist you to burn fats, and construct lean muscle. In flip, the physique goes to slim down, and you will really feel significantly better, more healthy, and you will look significantly better with the fitting meals in your life.

Crucial step to a more healthy life is the change to a nutritious diet. Get extra info from the free copy of my e-book report back to make higher selections!"
1029,2024-10-29 08:34:30,Google News,https://news.google.com/rss/articles/CBMiqwFBVV95cUxPQzRvOFpnMTlKUXdITWMwVnBKV25oTERubVo0UkY4U3lTZkNGRk1HcC0xQ0hCamNsSU1WVjY3c3d5R0g5RUtFaDI1REhqUjEtdVpVSVJvVV9XTTJhWTljZjE0WjFxcU5wUE5qeXhJYXJ2c2JuTldud0UzNEFVSGwyb1YxRXRteGFWV3AwWGl6bThyc3F0XzhkZmZBdzBxa0owUHR1aWt6UkhISHM?oc=5,Health,
1029,2024-10-29 08:32:28,Google News,https://news.google.com/rss/articles/CBMimgFBVV95cUxNS0N5WGpORWNvTlN3eXE5NHB1eUJaZWdvZnkyYmpoYWF6Zmo3MnJKckRYeVNuZkNudnFMRzE1SmJDZ2M1NWpJQ29qbjI4eGZyMEl6TmU2U0hsYW9JazNCeXdUWktWazJFZ2hHYXlVN2J2RFpKbHJGSUhidkVzUTBlNHFidERIZVdHWURVSmhaaXBMTkpQSUktbWxn?oc=5,Health,
