"TITLE","ARTICLE LINK","PUBLISHED DATE (GMT)","AUTHOR","PUBLISHER","COUNTRY","CATEGORY","LANGUAGE","DESCRIPTION","IMAGE URL","VIDEO URL"
"""Surging Interest in 2024 Which Asian Travel Destinations Are Captivating Globetrotters? Could Seoul, Halong Bay, Phnom Penh, or Sapa Be Your Next Adventure?""","https://www.travelandtourworld.com/news/article/surging-interest-in-2024-which-asian-travel-destinations-are-captivating-globetrotters-could-seoul-halong-bay-phnom-penh-or-sapa-be-your-next-adventure/","2024-10-29 08:31:35","","Travel And Tour World","United States Of America","Tourism","English","As travelers shift their focus to Asian destinations, 2024 trends reveal Tokyo and Seoul as top choices, indicating significant changes in the global travel landscape and industry dynamics.The post Surging Interest in 2024 Which Asian Travel Destinations Are Captivating Globetrotters? Could Seoul, Halong Bay, Phnom Penh, or Sapa Be Your Next Adventure? appeared first on Travel And Tour World.","https://www.travelandtourworld.com/wp-content/uploads/2024/10/tokyo.jpg",""
"""Global European Marketplace to Bring 50,000 Visitors in London, Connecting 800+ Industry Professionals for Fresh Insights""","https://www.travelandtourworld.com/news/article/global-european-marketplace-to-bring-50000-visitors-in-london-connecting-800-industry-professionals-for-fresh-insights/","2024-10-29 08:20:00","","Travel And Tour World","United States Of America","Tourism","English","The Global European Marketplace 2024 in London, UK unites 800+ travel professionals, expecting 20,000-50,000 visitors from October 31 to November 1, boosting tourism.The post Global European Marketplace to Bring 50,000 Visitors in London, Connecting 800+ Industry Professionals for Fresh Insights appeared first on Travel And Tour World.","https://www.travelandtourworld.com/wp-content/uploads/2024/10/gSMRsUNTNOuQhdPUx6BxA-1-850x477.jpg",""
"""Researchers uncover ancient tiny house amid city excavation project""","https://www.foxnews.com/travel/researchers-uncover-ancient-tiny-house-amid-city-excavation-project","2024-10-29 08:00:35","","Fox News","United States Of America","Tourism","English","Researchers uncovered a tiny house called the ""House of Phaedra"" during excavation work in the ancient city of Pompeii, Italy. Paintings of mythological scenes are depicted on walls.","https://a57.foxnews.com/static.foxnews.com/foxnews.com/content/uploads/2024/10/931/523/2024-10-24t165719z_1074873011_rc2b4r87v6m2_rtrmadp_3_italy-pompeii.jpg?tl=1&ve=1",""
"""Centrum Air to Launch Weekly Service from Tashkent to Colombo""","https://www.travelandtourworld.com/news/article/centrum-air-to-launch-weekly-service-from-tashkent-to-colombo/","2024-10-29 07:47:49","","Travel And Tour World","United States Of America","Tourism","English","Centrum Air introduces a new weekly route from Tashkent to Colombo, enhancing Uzbekistan-Sri Lanka connectivity for the Northern Winter 2024-2025 travel season.The post Centrum Air to Launch Weekly Service from Tashkent to Colombo appeared first on Travel And Tour World.","https://www.travelandtourworld.com/wp-content/uploads/2024/10/Centrum-Air.jpeg",""
"""American Airlines Launches New Winter Intercontinental Flight Network, Adjusting Routes and Aircraft for Key International Destinations""","https://www.travelandtourworld.com/news/article/american-airlines-launches-new-winter-intercontinental-flight-network-adjusting-routes-and-aircraft-for-key-international-destinations/","2024-10-29 07:35:43","","Travel And Tour World","United States Of America","Tourism","English","American Airlines revises its intercontinental routes for Winter 2024/25, with new aircraft assignments, route suspensions, and increased frequencies on select key international destinations.The post American Airlines Launches New Winter Intercontinental Flight Network, Adjusting Routes and Aircraft for Key International Destinations appeared first on Travel And Tour World.","https://www.travelandtourworld.com/wp-content/uploads/2024/10/American-Airlines-11.jpg",""
"""International Air Transport Association (IATA) to Integrate Digital Currencies in Financial Settlement Systems, Starting with China’s Digital Renminbi by End of 2024""","https://www.travelandtourworld.com/news/article/international-air-transport-association-iata-to-integrate-digital-currencies-in-financial-settlement-systems-starting-with-chinas-digital-renminbi-by-end-of-2024/","2024-10-29 07:27:28","","Travel And Tour World","United States Of America","Tourism","English","IATA embraces digital currencies, starting with the digital Renminbi in 2024, to streamline payments in the aviation sector, responding to global digital payment trends.The post International Air Transport Association (IATA) to Integrate Digital Currencies in Financial Settlement Systems, Starting with China’s Digital Renminbi by End of 2024 appeared first on Travel And Tour World.","https://www.travelandtourworld.com/wp-content/uploads/2024/10/IATA.jpg",""
"""Vietnam Invites China State Construction Engineering Corporation to Join $67 Billion High-Speed Railway Project for Enhanced Connectivity""","https://www.travelandtourworld.com/news/article/vietnam-invites-china-state-construction-engineering-corporation-to-join-67-billion-high-speed-railway-project-for-enhanced-connectivity/","2024-10-29 07:09:01","","Travel And Tour World","United States Of America","Tourism","English","Vietnam’s $67B high-speed railway project advances with CSCEC's involvement, aiming for improved cross-border connectivity and modern infrastructure with a planned 2027 groundbreaking.The post Vietnam Invites China State Construction Engineering Corporation to Join $67 Billion High-Speed Railway Project for Enhanced Connectivity appeared first on Travel And Tour World.","https://www.travelandtourworld.com/wp-content/uploads/2024/10/Vietnam-Travel.jpg",""
"""Saudi Ministry of Tourism Enforces Licensing for Tourism Facilities, Strengthening Quality Standards in Key Destinations Across the Kingdom""","https://www.travelandtourworld.com/news/article/saudi-ministry-of-tourism-enforces-licensing-for-tourism-facilities-strengthening-quality-standards-in-key-destinations-across-the-kingdom/","2024-10-29 07:00:29","","Travel And Tour World","United States Of America","Tourism","English","Saudi Arabia’s Ministry of Tourism emphasizes the importance of obtaining licenses for tourism facilities, implementing penalties for violations to uphold quality and safety standards.The post Saudi Ministry of Tourism Enforces Licensing for Tourism Facilities, Strengthening Quality Standards in Key Destinations Across the Kingdom appeared first on Travel And Tour World.","https://www.travelandtourworld.com/wp-content/uploads/2024/10/SAUDI-ARABIA-9.jpg",""
"""Air Astana Launches New International Routes to Saudi Arabia, Abu Dhabi, Phuket, Maldives, Vietnam, Amsterdam, Seoul, China Enhancing Connectivity and Travel Options for Passengers""","https://www.travelandtourworld.com/news/article/air-astana-launches-new-international-routes-to-saudi-arabia-abu-dhabi-phuket-maldives-vietnam-amsterdam-seoul-china-enhancing-connectivity-and-travel-options-for-passengers/","2024-10-29 07:00:15","","Travel And Tour World","United States Of America","Tourism","English","Air Astana’s Winter 2024 schedule introduces new international routes, expanding flights across the Middle East, Asia, and Europe, offering increased connectivity for travelers.The post Air Astana Launches New International Routes to Saudi Arabia, Abu Dhabi, Phuket, Maldives, Vietnam, Amsterdam, Seoul, China Enhancing Connectivity and Travel Options for Passengers appeared first on Travel And Tour World.","https://www.travelandtourworld.com/wp-content/uploads/2024/10/Air_Astana_A321neoLR_compressed-850x478.jpg",""
"""U.S. Hotel Development Hits New Milestone as Pipeline Expands to 6,211 Projects and 722,821 Rooms""","https://www.travelandtourworld.com/news/article/u-s-hotel-development-hits-new-milestone-as-pipeline-expands-to-6211-projects-and-722821-rooms/","2024-10-29 06:55:44","","Travel And Tour World","United States Of America","Tourism","English","The U.S. hotel construction pipeline hits a record high with 6,211 projects, signaling robust growth across segments and a strong outlook for new openings through 2026.The post U.S. Hotel Development Hits New Milestone as Pipeline Expands to 6,211 Projects and 722,821 Rooms appeared first on Travel And Tour World.","https://www.travelandtourworld.com/wp-content/uploads/2024/10/smiling-businessman-communicatin-850x638.jpg",""
