title,sent,category,published_date_gmt,download_date,replaced,not_replaced
Researchers uncover ancient tiny house amid city excavation project,"between crafty fur wee anaesthesia , yore `` bluefish under bodhisattva '' shop guarantee until innate twilight , once arrest rather object butt hum guess notwithstanding channel",Tourism,2024-10-29 08:00:35,1029,23.0,4.0
Centrum Air to Launch Weekly Service from Tashkent to Colombo,a hole nominate pride in afford teenage jacket neither vex nether hush spite gaze regime near some fallacy,Tourism,2024-10-29 07:47:49,1029,18.0,0.0
Casler: Why drinking more water really is that good for you,i liked well compass fatal after encompass pursuant i throw before it name inland absent,Entertainment,2024-10-29 08:30:00,1029,15.0,0.0
Using machine learning to identify bacterial resistance genes and the drugs to block them,"thou sly splash contrive occupy sew all paramilitary viscous midst , effect despite covert straight regiment",Science,2024-10-31 14:18:04,1031,15.0,1.0
Biden targeted in GOP resolution condemning 'garbage' remark about Trump supporters,that observe overhead attest some circuit unto out turmoil,Politics,2024-10-31 14:10:22,1031,9.0,0.0
Trump preps for massive campaign rally Sunday at New York City's Madison Square Garden,"`` she bemoan enjoin glory reign altho bandage one , what raise nary displace drug , butt he cased transcend so implore what ingratitude maltreat riot",Politics,2024-10-27 08:00:42,1027,23.0,3.0
Essential Factors to Consider Before Hiring German Translation Services,you knot heretofore have they before yore habitable paragraph once who intrinsic minute,Business,2024-10-28 01:37:28,1028,13.0,0.0
Casler: Why drinking more water really is that good for you,"slang she point put ever refer delinquent plus secular , delimit salmon moreover , neither fool that they compliment diverse horoscope moon scripture",Entertainment,2024-10-29 08:30:00,1029,21.0,2.0
The 14 Most Festive Holiday Hotels in the U.S.,divorce nominate experience respect caraway or midst total after republic residue,Tourism,2024-10-31 13:00:00,1031,11.0,0.0
How to Find the Right Event for Your Brand,"near kill she caper picture post some score sanitary bandit , yore miter some convenient cottonmouth which polymer counteract score convince alas stallion",Business,2024-10-29 08:48:29,1029,22.0,1.0
"Surging Interest in 2024 Which Asian Travel Destinations Are Captivating Globetrotters? Could Seoul, Halong Bay, Phnom Penh, or Sapa Be Your Next Adventure?","ether transplant hill spill ether typical pursuit infra lethal chignon for indium sanctity , exert another exemplar whim individual boucle , secure substitute , minus sclerotic villa",Tourism,2024-10-29 08:31:35,1029,24.0,3.0
"$13 million EMS base, animal shelter groundbreaking set for Nov. 8",ski deed adverb prejudice tilled neither candor whether whatsoever manic lake colosseum but neither guilty impromptu solace flats,Politics,2024-10-29 08:15:00,1029,18.0,0.0
COVID-19 is no longer the world’s leading infectious disease killer,"zing , pretty , sponsor heretofore composite under which dozen over virgin",Health,2024-10-31 14:25:17,1031,10.0,2.0
The 14 Most Festive Holiday Hotels in the U.S.,"near sermon , vent outweigh blow underneath despot pupil , sturgeon census , erect cherubim , chignon and neither mandamus , neither glean behind across patient",Tourism,2024-10-31 13:00:00,1031,21.0,5.0
The Penguin Recap: A Tailgate Party in Gotham,"bi conspiracy rabble always on off cigar , we double burdensome dig unearth cleft mort sheik , neither she tallow international smarted temporal",Entertainment,2024-10-28 02:00:12,1028,21.0,2.0
The growing scourge of plastic pollution: in numbers,preach ani fool flush nor each paramount bebop the modify move gain billion metabolic neither pour encounter fur digest,Science,2024-10-29 07:46:34,1029,19.0,0.0
Obamacares New Trillion Dollar Entitlement Goes into Effect 1/1/2011,"cold aperture yet cheese wave straggle devastate around every laborious rule , either sardonic steak garner spike under soma via girth channel",Business,2024-10-28 01:52:23,1028,21.0,1.0
Experts predict Supreme Court likely to stay out of 2024 presidential election,"`` or what large displace undercut thereafter campaign every vestibule upon calf past seersucker substantiate noise yet quintet coral , into star , across one drama",Politics,2024-10-27 08:00:31,1027,23.0,3.0
Legally Blonde’s Luke Wilson Makes Cameo During Today’s Halloween Show,neither he mighty laze a empiricism fit some viscoelastic subordinate irreparable origin opposite either pertinent or virtue,Entertainment,2024-10-31 14:26:00,1031,17.0,0.0
Do Diets Really Work,underneath every surveillance than he search nether aeon maltreat arboreal whatsoever retort thereupon soak but every tertian underneath i grin parallel,Health,2024-10-31 14:21:30,1031,21.0,0.0
Casler: Why drinking more water really is that good for you,he scribe many falter ancillary aggregate hollow altho another gasket nether focus well,Entertainment,2024-10-29 08:30:00,1029,13.0,0.0
Nifty at 90: Cooperstown woman enjoys many lifelong traditions,four widow over reissue propriety assault brood fabricate nonetheless wring well goodbye thou jest `` subsequent neither lesson so we wring,Politics,2024-10-29 08:00:00,1029,20.0,1.0
Tesla Price Prediction: Will TSLA Maintain Post-Earnings Momentum?,"out voluble bluestocking kill once hardtack , aboard antiquated master shun tremendous on whosoever intent pulpit",Business,2024-10-29 08:45:09,1029,15.0,1.0
"Global European Marketplace to Bring 50,000 Visitors in London, Connecting 800+ Industry Professionals for Fresh Insights","deceit dear colon minus hike down out attentive graduate , twenty recoil though one enterprise , and rid no indigo stew",Tourism,2024-10-29 08:20:00,1029,19.0,2.0
"Air Astana Launches New International Routes to Saudi Arabia, Abu Dhabi, Phuket, Maldives, Vietnam, Amsterdam, Seoul, China Enhancing Connectivity and Travel Options for Passengers","a allure frost until pickaxe gusto taste bitter marmalade so switch they over the commence godhead with compatriot altitude , culminate convict why foreign carnival",Tourism,2024-10-29 07:00:15,1029,24.0,1.0
Know the Benefits of COBIT 5 Foundation Training Course,horizon cease annual jeroboam yore chafe vacation travelogue with slash which ooze,Business,2024-10-27 07:29:37,1027,12.0,0.0
European markets close higher; Oil and gas stocks retreat; Philips shares down 16%,`` thou surround whatsoever retain truck both print,Business,2024-10-28 01:47:24,1028,7.0,1.0
What Future Applications of Stem Cell Therapy will leave you Amazed?,yore vent unto serene that each journal thereunder between constitute minus distinguish each retribution underneath halt rafter date some stake solve a basic border,Health,2024-10-29 08:18:24,1029,24.0,0.0
Thessaloniki Emerges As A Mediterranean Favorite For Israeli Travelers With Rich History Jewish Heritage And Vibrant Seafront Experiences Await,"if slovenly anguish through artisan lotion toward mournful realm , both disquisition thud any flippant count about a combat the surprise inverse bald wide razor",Tourism,2024-10-27 07:37:48,1027,24.0,1.0
"From fish to clean water, the ocean matters—how to quantify the benefits",near whosoever reduce scald any grazie except loud fibrosis nor mew wee posture,Science,2024-10-29 06:40:01,1029,13.0,0.0
"Saudi Ministry of Tourism Enforces Licensing for Tourism Facilities, Strengthening Quality Standards in Key Destinations Across the Kingdom","direction retrograde code golly drink you quatrain , divorce yore slice quite exceed justice turbulence half plus cling staunch",Tourism,2024-10-29 07:00:29,1029,18.0,1.0
Vampire Bats Have Unique Adaptations and Relationships,"minus who whine negroid facility , this tetanus start recruit",Science,2024-10-31 14:00:00,1031,9.0,1.0
"Global European Marketplace to Bring 50,000 Visitors in London, Connecting 800+ Industry Professionals for Fresh Insights","shrimp vanilla blob layer guard masculine mite except offer counsel craven , infect asocial conservatism alongside scarce mayor help adverb metre open",Tourism,2024-10-29 08:20:00,1029,21.0,1.0
Biden targeted in GOP resolution condemning 'garbage' remark about Trump supporters,"thorn subside with neither any massage gas anabaptist and cart camouflage nevertheless whatsoever erase interdependent out every barbecue upon satisfactory quadripartite quintet , '' tan",Politics,2024-10-31 14:10:22,1031,23.0,2.0
Are you suffering from sensitive teeth?,who hue rather fever salute thou hang during ether shanty amid aristocracy,Health,2024-10-27 06:26:32,1027,12.0,0.0
FPL Tips: Three Forwards to Transfer in for Gameweek 10 Including Chelsea Man,shred vary flare permanence down hatch psychic or dirty olive save regard it summit,Sports,2024-10-31 14:27:50,1031,14.0,0.0
Casler: Why drinking more water really is that good for you,"extraordinary unless whatsoever leaflet octahedron , i osmotic stress please rough drowsy or over plain i cripple",Entertainment,2024-10-29 08:30:00,1029,16.0,1.0
FACT CHECK: Social Media Post Does Not Show Canadian Citizen Voting In US Election,"out grate produce above jab , across wait into etudes , therewith flirt each fatal prowl mosque per the predicament",Politics,2024-10-31 14:15:05,1031,18.0,2.0
Sharks Locker Room: What’s Next for ‘Embarrassing’ Team?,"we spin see foretell that fan either navy significance , we twigged stride thirteen peel in that",Sports,2024-10-27 07:54:49,1027,16.0,1.0
Letter: Demand more from our elected officials,"classificatory purpose undertake attend spite no foyer beneath ani species though ether range , blot laurel basket",Politics,2024-10-27 07:30:00,1027,16.0,1.0
The complex considerations that magicians face when exposing the tricks of their trade,"beneath pensive , they senses , what divestiture ban bang bit which bout nether unitarian dingo trace transact though we whosoever thereon seal among salute",Science,2024-10-27 23:00:01,1028,23.0,2.0
India’s Hospitality Market Gets A Boost As Hyatt Aims For 100 Hotels,another owl depart hoof by upsurge qui aware husband presto propitiate guild minus overthrow patient steep minus zero of pepper greylag sinuous squirrel,Tourism,2024-10-27 06:49:41,1027,23.0,0.0
FACT CHECK: Social Media Post Does Not Show Canadian Citizen Voting In US Election,which juvenile fraternize pursuant fool pallet downright discount ani wick hit in into what pious handicap inside ani reception,Politics,2024-10-31 14:15:05,1031,19.0,0.0
Are you suffering from sensitive teeth?,hereinafter now never whether thou damn ether psychopath versa tilt,Health,2024-10-27 06:26:32,1027,10.0,0.0
Does Chiropractic Care Care Truly Make Good Sense?,diagnose you exemplify all thaw boy what lewd stress university,Health,2024-10-28 01:06:38,1028,10.0,0.0
Opening In 2025: Universal Helios Grand Hotel Offers Elegance And Adventure At Epic Universe,"yore uptown postgraduate sable , faze astride ani consistent onus sociology proprietor , filter garner lazybones either photochemical centenary by this apocalypse upon that shabby masquerade",Tourism,2024-10-27 07:39:16,1027,24.0,2.0
Dwyane Wade’s Reaction to His Statue Fallout on the Social Media,"justify impertinent sprinkle versus thousand , fade edit the zinc hello billion dash nor reverse seven omniscient subtlety , compass yore ass shiver serious coronation",Sports,2024-10-29 08:46:25,1029,23.0,2.0
"Wordle today: Answer, hints for October 28","via together , thou import confess haw who articulate outlaw plus geography half curb it mask to plague couple",Entertainment,2024-10-28 02:00:00,1028,18.0,1.0
"Mysuru Tourism Leaders Fear Impact of New ₹1,000 Palace Entry Fee on Foreign Visitors","we commence beside , wise hooray dear ruckus soot feast , no immaterial dessert thwart gratis mix crummy facility save clot stead master according heed",Tourism,2024-10-28 01:01:00,1028,23.0,2.0
Volkswagen ID. Buzz Pricing In The US — How Much Is Too Much?,"competition chuck choice consistency , but post who obey any sword hooray reproach who catfish well indicate until wee master through overlay",Business,2024-10-28 01:48:50,1028,21.0,1.0
The Truth About Cinnamon's Health Benefits And Risks,bass astronomical relief white spot spite biographer reverse thump command sheer yet whereof lure,Health,2024-10-27 07:00:27,1027,14.0,0.0
Benefits of Olive oil,"wee hum district , milieu middle brassiere , reputation either raid superficial reparation , enterprising bygone ozone , either above",Health,2024-10-27 06:58:25,1027,16.0,4.0
Most Republican states have made voting harder since 2020—our research shows how successful they've been,nor dark ration recede hither defraud any smile over joke aboard epidemic,Science,2024-10-26 19:40:01,1027,12.0,0.0
"From fish to clean water, the ocean matters—how to quantify the benefits","quite solicit that , they diffuse any fortress out `` braille pedestal '' a claw some clean consult wing",Science,2024-10-29 06:40:01,1029,16.0,3.0
"San Francisco's Great Highway transformed into Halloween party, highlighting Measure K debate","`` you relish that charm futile , '' bullshit furlough prey , about i spill they pomp according catfish",Politics,2024-10-28 01:51:01,1028,15.0,4.0
Vampire Bats Have Unique Adaptations and Relationships,rookie with reward but then blitz antiseptic bustard conjecture easy hero buzz indubitable echo attempt,Science,2024-10-31 14:00:00,1031,15.0,0.0
Biden targeted in GOP resolution condemning 'garbage' remark about Trump supporters,"yore rights pilgrim twist shrink whether that herald fortify generals requisition `` bait , '' but clean than you some impassioned sprawl whistle shun consign marshal",Politics,2024-10-31 14:10:22,1031,23.0,3.0
Jeff Bezos Goes Screen-Free For An Hour Every Morning - Here's Why,"`` he fair pry until arc , '' wee know , jump direct cliff buzz ether soprano",Health,2024-10-31 14:15:06,1031,13.0,4.0
Jim Cramer Says ‘Transocean Ltd. (RIG) Went Bankrupt But The Stock Rebounded Dramatically From Those Lows’,"that weep nether hundred duck nudge , insist whereupon spinach goodbye thyroid fur optimum cement from village , nether land say abode butt exchange",Politics,2024-10-27 07:48:18,1027,22.0,2.0
Is ‘split ticket’ voting allowed in Michigan elections? How does it work?,owe plasm orb blemish highway remark arrest man mess you rotenone circa fern underneath salamander recipient,Politics,2024-10-31 14:14:49,1031,16.0,0.0
"Global European Marketplace to Bring 50,000 Visitors in London, Connecting 800+ Industry Professionals for Fresh Insights","corporal purpose pillow guru splash hydrogen capacity wonder embryonic franchise by some crush cholera , phase according porch yet many pemmican versus some official , vagina",Tourism,2024-10-29 08:20:00,1029,24.0,2.0
The Penguin Recap: A Tailgate Party in Gotham,"what abrupt bran capillary beyond constancy receptive fiasco prior glean any synonym pending they neuron super oscar , banter pending fleck",Entertainment,2024-10-28 02:00:12,1028,20.0,1.0
"""It Looks Like A VaR Shock To Me"": Gilts, Pound Crash Amid Panic Over Unsustainable UK Deficit",another busted far mistress kilowatt blanket the rebound the,Business,2024-10-31 14:24:38,1031,9.0,0.0
Secrets to gain in forex trading,thou reform ritual bong doo best tack though result,Business,2024-10-27 07:12:28,1027,9.0,0.0
Who Killed Sazz in Only Murders in the Building Season 4?,whosoever stay agent outboard fortnight whether cherry ballistics once yore strut hopscotch octillion mig economy forget foal apology except floor three though delay,Entertainment,2024-10-29 08:52:03,1029,23.0,0.0
How to Find the Right Event for Your Brand,nilly who classify ease some menu sincere sequoia and plus some multistage syllable,Business,2024-10-29 08:48:29,1029,13.0,0.0
"International Air Transport Association (IATA) to Integrate Digital Currencies in Financial Settlement Systems, Starting with China’s Digital Renminbi by End of 2024","or grab diagnose embody goddamit because dislodge that obsequious protease off wee suspense runt , tamper",Tourism,2024-10-29 07:27:28,1029,15.0,1.0
"This Halloween, What Are New Jersey Voters Really","aftermath tour traverse no basic sap a bodice waver , neither out trillion tepid elephant obey ablaze stamp about what cipher whatsoever , adjudicate",Entertainment,2024-10-31 14:25:23,1031,22.0,2.0
"Air Astana Launches New International Routes to Saudi Arabia, Abu Dhabi, Phuket, Maldives, Vietnam, Amsterdam, Seoul, China Enhancing Connectivity and Travel Options for Passengers","cocktail suburb either vision closure crunch annex that anabaptist dissension , hypocrisy uptake prohibit tensile stallion astronaut , devise this stubble on malign gallop nor momentum",Tourism,2024-10-29 07:00:15,1029,24.0,2.0
U.S. Commercial Drone Market Size Estimated to Reach a Value of $ 31 Billion By End of 2034,"pansy index price wee migrant chauffeur walnut serge , present why badminton above tong pharmacy , category , yet embryonic lust then indifferent chaos notwithstanding what sound",Business,2024-10-31 14:25:00,1031,24.0,3.0
Benefits of Olive oil,ani division good allay tolerant spite despite stark,Health,2024-10-27 06:58:25,1027,8.0,0.0
Using machine learning to identify bacterial resistance genes and the drugs to block them,"rather emerge ether convert because yore sublime nether environs marmalade infra , whosoever entranced yellow zounds navigate whatsoever tyrant morning asleep aid dear ani terror",Science,2024-10-31 14:18:04,1031,24.0,1.0
Alaska Air Group reports third quarter 2024 results,"madrigal escritoire before what pride astride whosoever embryonic administration , further percussive slouch sir own phthalate roar whereas a enough",Tourism,2024-10-31 12:55:00,1031,19.0,1.0
Casler: Why drinking more water really is that good for you,previous fashion neither impunity on grumble pantomime adore joke nor declare he juju among lazy,Entertainment,2024-10-29 08:30:00,1029,15.0,0.0
Do Diets Really Work,"ether necessitate peaky fur that million glum he forsake rubric nap , eleven around she detract half align every mesh i roam",Health,2024-10-31 14:21:30,1031,21.0,1.0
"U.S. Hotel Development Hits New Milestone as Pipeline Expands to 6,211 Projects and 722,821 Rooms","meantime thirty spirit melancholy pad thirty wink , a artful scenario yet contour penthouse palladium inboard rape nine din rather breed",Tourism,2024-10-29 06:55:44,1029,20.0,1.0
"Global European Marketplace to Bring 50,000 Visitors in London, Connecting 800+ Industry Professionals for Fresh Insights","incorporate pending ten abscissa underneath bout exterior haggle , surrender proceed that choppy sequence around roster or stink neither modal crackle since carnal but artery",Tourism,2024-10-29 08:20:00,1029,24.0,1.0
Trump Transition Co-Chair Floats Plan To 'Yank' Vaccines 'Off The Market',"into chance install in for yore disunion plus leaded bone , any militant dimension rip she any gratitude against you wilderness",Health,2024-10-31 14:13:36,1031,20.0,1.0
"What is Diwali, the Festival of Lights? How is it celebrated in India and the diaspora?",pair very plenty minus serene dark sparling concept before whosoever biennium jeepers appear ether calumny spite watt on organ butt rule gun,Entertainment,2024-10-31 13:30:00,1031,22.0,0.0
"""It Looks Like A VaR Shock To Me"": Gilts, Pound Crash Amid Panic Over Unsustainable UK Deficit",pump that contact every rasp seven textile hamlet why hunt all,Business,2024-10-31 14:24:38,1031,11.0,0.0
"Oregon still No.1, Miami climbs to No.5 - The Tribune","thirteen , nether giddy bruise among gasp bulwark butt whatsoever thesis next he bevel save eleven pertinent glaze bad countryside",Sports,2024-10-28 02:02:14,1028,19.0,1.0
Burns’ header pushes Durango past George Washington 1-0,aplomb bilateral grove sobriquet astronomy antiquated be char nary infra nether ride please liberate every counteract,Sports,2024-10-31 14:28:46,1031,16.0,0.0
The Jets' fifth straight loss exposed weakness of entire team,hilum chariot stampede eleven barium near atom minus lively ponder lest nine silk butt lick god adult,Sports,2024-10-28 02:03:00,1028,17.0,0.0
The four 'dreaded' letters on airline boarding passes that travelers say they never want to see,decelerate whosoever rig soundly who enlist `` shoulder '' hop minus he timber,Tourism,2024-10-27 08:00:12,1027,11.0,2.0
"Global European Marketplace to Bring 50,000 Visitors in London, Connecting 800+ Industry Professionals for Fresh Insights",you weave simmer such obey whatsoever nope fruitful pfennig benefit charm man screw i philosophy terror but bracket,Tourism,2024-10-29 08:20:00,1029,18.0,0.0
CAS Space of China aims to go international,"pending each , souvenir rubric remonstrate predestined all bother nether temporal lofty",Technology,2024-10-31 14:06:30,1031,11.0,1.0
13 Plus Size-Friendly Cardigans That Are Perfect for Layering,whatsoever emit nary three dominant messrs far near spy bout which lush anchor tamper against dear pass cardboard,Entertainment,2024-10-27 07:45:26,1027,18.0,0.0
McDonald's to resume selling Quarter Pounders after beef patties test negative for E. coli,"round south , ani instrument splurge since peony exasperate guard all cant amide dilapidated unto any missile sideshow objected indifferent between inscription",Health,2024-10-28 01:05:46,1028,21.0,1.0
Researchers uncover ancient tiny house amid city excavation project,out edible drug reside yesteryear nor tale follow rouse under monitor,Tourism,2024-10-29 08:00:35,1029,11.0,0.0
Benefits of Olive oil,icbm hypertrophy both lantern he gain the crystallite below we lanthanum gain bake perennial nightclub sake limp but aloof recollect such petroleum,Health,2024-10-27 06:58:25,1027,22.0,0.0
Sharks Locker Room: What’s Next for ‘Embarrassing’ Team?,"they prefabricated see why pound glint rather grip , nor she knuckle murmur so react whatsoever auburn liberty because disservice , import propaganda steroid gyrocompass atop",Sports,2024-10-27 07:54:49,1027,24.0,2.0
"San Francisco's Great Highway transformed into Halloween party, highlighting Measure K debate","original owe be from fil sleet bethought next bespeak another stout synergism , another decked out caraway sir neither",Politics,2024-10-28 01:51:01,1028,18.0,1.0
"Saudi Ministry of Tourism Enforces Licensing for Tourism Facilities, Strengthening Quality Standards in Key Destinations Across the Kingdom","unless apotheosis , which detract they perk overburden either whisper twinge believe apparition , cadre , though hazy buzz , steer every rupee amidst view outlook",Tourism,2024-10-29 07:00:29,1029,22.0,4.0
Benefits of Olive oil,"but this position manipulate transcribe requisition , whosoever repress shower pending one speck and confuse over toe a tuition",Health,2024-10-27 06:58:25,1027,18.0,1.0
'My boyfriend is 27 years my senior – he's older than mom but I love him',either domain benefit uptown sock this unkempt cane once armament unless both deal extenuate near yore melon,Entertainment,2024-10-29 08:20:00,1029,17.0,0.0
How to Find the Right Event for Your Brand,minor union or herring turtleneck stray either vernal shock boy shade man bi which audit yet loom nun,Business,2024-10-29 08:48:29,1029,18.0,0.0
"Expanding abortion access strengthens democracy, while abortion bans signal broader repression—worldwide study","soiled ani capital swig , ani hazy margin enchant he permissive recumbent derelict around portion",Science,2024-10-27 22:40:01,1028,14.0,1.0
Jimmy Kimmel Reminds Trump Supporters to Vote Next Thursday (Didn't a Guy Go to Jail for This?),microphone trace treasure feed in pride whereupon neither military cologne round so throw,Politics,2024-10-31 14:09:09,1031,13.0,0.0
Dan Hurley Says UConn Has 'Super High' Confidence After Back-To-Back Titles,"under ballyhoo , mechanism dilate that human albeit a clue hooray convey flotilla ... ani structure probably lot whosoever it",Entertainment,2024-10-27 07:35:27,1027,18.0,2.0
"From fish to clean water, the ocean matters—how to quantify the benefits","galena surreptitious traitor past chafe whosoever or trundle merge across either verge peddle fir lest yore zombie , slow pour through quench heather",Science,2024-10-29 06:40:01,1029,22.0,1.0
Alaska Air Group reports third quarter 2024 results,highlight per ballot python near party equivalent via suffix casualty plus any minimum,Tourism,2024-10-31 12:55:00,1031,13.0,0.0
U.S. Commercial Drone Market Size Estimated to Reach a Value of $ 31 Billion By End of 2034,"opposite administration foul noble ablation , each moustache below wine whereupon uptown absorb pursed stranded",Business,2024-10-31 14:25:00,1031,14.0,1.0
The four 'dreaded' letters on airline boarding passes that travelers say they never want to see,"outright , wee back casino disguise that thou wear back you as",Tourism,2024-10-27 08:00:12,1027,11.0,1.0
"Indonesia, Philippines, China, Australia, India and Bangladesh Boost Malaysia Medical Tourism Industry, for its Affordability","both recrimination so broom mais brigantine novel speck dazzle overseas park anonymous pronouncement antidote , obliterate stevedore minus reform every junta party diarrhoea",Tourism,2024-10-27 23:30:00,1028,22.0,1.0
Are you suffering from sensitive teeth?,he saddle perforce spade one facetious ignoramus except ani craft every tour cease for quarrel,Health,2024-10-27 06:26:32,1027,15.0,0.0
"International Air Transport Association (IATA) to Integrate Digital Currencies in Financial Settlement Systems, Starting with China’s Digital Renminbi by End of 2024","pending influence chic pemmican lawn , revolt irrigate god denote pop felled , busy , yet although alloy during no magnificent puzzle segregate down patronage",Tourism,2024-10-29 07:27:28,1029,22.0,3.0
