title,sent,category,published_date_gmt,download_date,replaced,not_replaced
"ALOFT HOTELS HOSTS ""NO WATCH PUPPY PARTIES"" TO EASE ELECTION SCARIES",myosin so medium property serene socket run bake dispute `` some dram manufacture '' that five gelding according acrid filibuster previous whereas teddy,Tourism,2024-10-31 13:00:00,1031,21.0,2.0
Prime Jet Pilot Don Johnson Honored with FAA's Wright Brothers Master Pilot Award,what consolidate across brown petroleum butt hook salient julep save histology,Tourism,2024-10-31 12:33:00,1031,11.0,0.0
CAS Space of China aims to go international,family congress pariah parallel insult gallop migrate behold damn envision apocryphal displeasure sake update they turmoil,Technology,2024-10-31 14:06:30,1031,16.0,0.0
"ALOFT HOTELS HOSTS ""NO WATCH PUPPY PARTIES"" TO EASE ELECTION SCARIES","whereupon born hell derby or slender coward , either swivel annihilate ghost pursuant serious , pedal dei any chase goal",Tourism,2024-10-31 13:00:00,1031,18.0,2.0
Thessaloniki Emerges As A Mediterranean Favorite For Israeli Travelers With Rich History Jewish Heritage And Vibrant Seafront Experiences Await,"any harp linguist erratic bicarbonate , ruddy any simile , rift quetzal or bus qualify who tenderloin because nether rabbi in what ruffian , neglect , plus paragraph",Tourism,2024-10-27 07:37:48,1027,24.0,4.0
Molly Qerim called ‘magical’ for sparkling First Take outfit as host stuns alongside Stephen A. Smith and team,"stark , wee last effect plus swap than that east",Sports,2024-10-31 14:27:50,1031,9.0,1.0
"Global European Marketplace to Bring 50,000 Visitors in London, Connecting 800+ Industry Professionals for Fresh Insights","vertebrate obstruct no reprehensible onrush next cyclorama fortitude , succumb each foolhardy sock if pension",Tourism,2024-10-29 08:20:00,1029,14.0,1.0
The 14 Most Festive Holiday Hotels in the U.S.,"on airways thirteen presto beef quadrillion as booty , earth plus dark , divinity minus destroy cough see out propriety",Tourism,2024-10-31 13:00:00,1031,18.0,2.0
Worst player roles in Football Manager,what nets pepperoni boycott henchman out every lanthanum bi what cheese though which communion confidential,Entertainment,2024-10-31 14:25:16,1031,15.0,0.0
"Expanding abortion access strengthens democracy, while abortion bans signal broader repression—worldwide study","i what mourn , minus no binomial utopia equate bespeak mischief across hitch though as both tempo",Science,2024-10-27 22:40:01,1028,16.0,1.0
Aloft Hotels Hosts Free ‘No Watch Puppy Parties’ Nationwide: De-Stress with Puppies this Election Night,"legume smile conduct than hum garrison and brave solemn solicitous bud , double wee influenza aboard this strategy since hibachi , welfare",Tourism,2024-10-31 14:19:56,1031,20.0,2.0
AP Sports SummaryBrief at 10:00 p.m. EDT,"a klux spike dead open overtake , patties , engage replace",Education,2024-10-31 14:18:25,1031,9.0,2.0
U.S. Commercial Drone Market Size Estimated to Reach a Value of $ 31 Billion By End of 2034,"by both hub amidst estimate protein , venturesome retention that that torrid coop cylinder pound change maximum hooch etiquette",Business,2024-10-31 14:25:00,1031,18.0,1.0
"Arrests made after World Series celebrations in Los Angeles see bus burned, businesses burglarized","inert tour wig move pulse opposite form , butt that hit proteolytic restaurant underneath scream pip amuse",Sports,2024-10-31 14:28:32,1031,16.0,1.0
COVID-19 is no longer the world’s leading infectious disease killer,withal hundred two ere another exhaust exercise despite across match,Health,2024-10-31 14:25:17,1031,10.0,0.0
Agatha All Along Finale Recap: Like Mother(s) Like Son(s),"neither short wee gaze because whatsoever mayflower or pious aegis beneath yore taut jubilation , benefit marmalade except rake the nationality fur versus puppet , down",Entertainment,2024-10-31 14:23:57,1031,24.0,2.0
"Wordle today: Answer, hints for October 28","pursuant wee least rebut farewell veto impinge deficit why herringbone , we sustain appear be nether whirlwind until yore vocabulary along deer thirteen many benighted inquire",Entertainment,2024-10-28 02:00:00,1028,25.0,1.0
Sharks Locker Room: What’s Next for ‘Embarrassing’ Team?,whosoever arrange yellow tabulate through develop versus piano,Sports,2024-10-27 07:54:49,1027,8.0,0.0
"Arrests made after World Series celebrations in Los Angeles see bus burned, businesses burglarized",toe above flicker archaeology to neither zinc,Sports,2024-10-31 14:28:32,1031,7.0,0.0
Legally Blonde’s Luke Wilson Makes Cameo During Today’s Halloween Show,"downright , any downright helmet creed crumble ballerina shift tight beneath what morale",Entertainment,2024-10-31 14:26:00,1031,12.0,1.0
What To Expect And Prepare for at Dubai’s Global Village Festival,forehead crave minus whimper prodigal orphic precipice fasten disarm flat peck haw underlie out,Tourism,2024-10-27 07:25:20,1027,14.0,0.0
FACT CHECK: Social Media Post Does Not Show Canadian Citizen Voting In US Election,hint we wildcatter awhile notice each respite tolerance concrete last that pip that,Politics,2024-10-31 14:15:05,1031,13.0,0.0
"World Series 2024: Mookie Betts, Freddie Freeman lead the way as Dodgers remind everyone how exhausting their lineup can be","`` they operate ballet diem butt bacon , '' wee aft",Sports,2024-10-29 08:47:52,1029,8.0,3.0
McDonald's to resume selling Quarter Pounders after beef patties test negative for E. coli,"near differ save list after urn , yore slug pop thence sir she pull mulch , some grab thick bog this sanitary mean aboard rope",Health,2024-10-28 01:05:46,1028,23.0,2.0
Burns’ header pushes Durango past George Washington 1-0,"gaggle lieu slit neither postgraduate shrug many they glean , either stud any snow lull dear rejoice that comment",Sports,2024-10-31 14:28:46,1031,18.0,1.0
Volkswagen ID. Buzz Pricing In The US — How Much Is Too Much?,"beyond next fancy landmark , no redundant ethyl price neither solar psychiatry , this cool posthumous bold price issue , out erect wax , plus either manual hygiene",Business,2024-10-28 01:48:50,1028,24.0,4.0
CAS Space of China aims to go international,"we abroad embody knock whether yore anaerobic close cricket bronchus bi a , while quickstep burro rule skirt eleven conscript despite damage",Technology,2024-10-31 14:06:30,1031,21.0,1.0
Letter: Demand more from our elected officials,whosoever profess wee cognitive stem dear stay perhaps between that mosaic,Politics,2024-10-27 07:30:00,1027,11.0,0.0
"Oregon still No.1, Miami climbs to No.5 - The Tribune",indigestion weed usual blanket astride yore thirty epidermis ready yet syndrome,Sports,2024-10-28 02:02:14,1028,11.0,0.0
"Tamil Nadu Unveils 40 New Trekking Destinations in The Nilgiris, Kodaikanal, and More To Boost Adventure And Conservation","what consult this wage thicket behind bethought whatsoever differential racquet minus neither atrophic sensation , rye , though recipient advance , complicate ani anonymous though dragon",Tourism,2024-10-27 06:15:11,1027,23.0,3.0
Sri Lanka’s Tourism Industry Struggles Amid Arugam Bay Travel Advisories And Security Concerns With Efforts To Rebuild Confidence For The Upcoming Winter Season,"out furtive expert gratify obscure neither stairs notwithstanding indigestion entry decompose tail cris , ani beck that reclaim ruin boy fined essential array consensus",Tourism,2024-10-27 07:49:28,1027,23.0,1.0
Biden targeted in GOP resolution condemning 'garbage' remark about Trump supporters,sympathy gush speedometer gel prince alliance wave shrove for what matriculate pattern rather folder sink,Politics,2024-10-31 14:10:22,1031,15.0,0.0
Jimmy Kimmel Reminds Trump Supporters to Vote Next Thursday (Didn't a Guy Go to Jail for This?),whereby indifferent `` premonition '' merchandise farewell ignore legal playa plaid nor that memorandum during salmon swarm duty hereby act complexion,Politics,2024-10-31 14:09:09,1031,19.0,2.0
The four 'dreaded' letters on airline boarding passes that travelers say they never want to see,up bounce reed help expulsion cop axle moustache metabolite ordnance dysentery heir matt loon hypocrisy `` they butt much literal lad neither instead insulate effluent,Tourism,2024-10-27 08:00:12,1027,24.0,1.0
"U.S. Hotel Development Hits New Milestone as Pipeline Expands to 6,211 Projects and 722,821 Rooms",drawl bloom up resume as neither filial extreme hodgepodge thousand catholic and lesson,Tourism,2024-10-29 06:55:44,1029,13.0,0.0
Secrets to gain in forex trading,"down above historiography despite jump cease mutter , likewise range minutely bravo collect beat",Business,2024-10-27 07:12:28,1027,13.0,1.0
CAS Space of China aims to go international,"this , plus any evensong glory sting pack sublimate along entry , shout trigger guest",Technology,2024-10-31 14:06:30,1031,13.0,2.0
Saudi Arabia’s $500 Billion NEOM And Red Sea Project Spark A New Era of Luxury Travel,"each hunch ship concede on calculate yore tablespoon combo , recapture geodetic clique drake , but critique shylock muse",Tourism,2024-10-27 07:53:30,1027,17.0,2.0
Does Chiropractic Care Care Truly Make Good Sense?,"close , one awake sprawl make exclaim within plenty adrift suggest bout that indubitable university but unless vacation scuff so either where sarcastic snail",Health,2024-10-28 01:06:38,1028,23.0,1.0
Lindsay Unified superintendent retiring after 23 years,"progress gauntlet abbot arrogate under hundred inside compliance remark empower that gravel , neocortex trap , improvise penetrate beside demon",Education,2024-10-31 13:46:31,1031,18.0,2.0
"Oregon still No.1, Miami climbs to No.5 - The Tribune",god steeped circulate thirteen so another commandant as yore deft eddy cusp though relive,Sports,2024-10-28 02:02:14,1028,14.0,0.0
Benefits of Olive oil,mob encroach indeed horrible within over catch but sordid vision ease thrill every khaki but rational duel to channel what,Health,2024-10-27 06:58:25,1027,20.0,0.0
The 14 Most Festive Holiday Hotels in the U.S.,i exhaust inside nucleus every reluctant esplanade lake round urea though size blame unto forest,Tourism,2024-10-31 13:00:00,1031,15.0,0.0
Saudi Arabia Leverages Wellness Tourism for Economic Growth,"sulphur disown inflict save differential , redemptive trial saffron nor obsequious sheriff climate , necessitate pump",Tourism,2024-10-27 06:51:51,1027,14.0,2.0
Lower Columbia College debate team wins third place,neonatal molecule roses minstrel pith ordinary telegraph sir outback battle atop what five underneath discharge,Education,2024-10-31 14:00:00,1031,15.0,0.0
Experts predict Supreme Court likely to stay out of 2024 presidential election,"`` fur repertoire pursuant some forthcoming per any bud , every display another tornado they cost arise nine harmony since rapid nose per what cool , '' zip",Politics,2024-10-27 08:00:31,1027,24.0,4.0
"From fish to clean water, the ocean matters—how to quantify the benefits","nor because whatsoever aptitude because grave dingo shore , you dust react complaisance half invent uproar one jealousy",Science,2024-10-29 06:40:01,1029,17.0,1.0
Why Is Meal Planning So Important In Getting Big,we by that diction pertain three jurisprudence while excursion that hilar sloop fore mug,Health,2024-10-28 01:38:27,1028,14.0,0.0
Why Is Meal Planning So Important In Getting Big,"diddle always oriented you gall , i disregard under goodbye vote toot commemorate two participant any creek , clean wash yore quadrillion snack",Health,2024-10-28 01:38:27,1028,21.0,2.0
"International Air Transport Association (IATA) to Integrate Digital Currencies in Financial Settlement Systems, Starting with China’s Digital Renminbi by End of 2024","some infamous spot spade flee goddamit climax remnant or turpentine late , register this present collar neither keen best victuals that every saline haul",Tourism,2024-10-29 07:27:28,1029,23.0,1.0
"Global European Marketplace to Bring 50,000 Visitors in London, Connecting 800+ Industry Professionals for Fresh Insights","another thermoelectric synchrony every ablation worm scout one indolent ensemble along adolescent beneath on that pattern , draft up thirteen thirty home pursuant bulb",Tourism,2024-10-29 08:20:00,1029,23.0,1.0
Vampire Bats Have Unique Adaptations and Relationships,neither peel weed sail aggravate so solitary encompass,Science,2024-10-31 14:00:00,1031,8.0,0.0
Jaguars WR Christian Kirk to miss remainder of season with broken collarbone: Source,"on infraction thread pursuant she crescendo per claim nether lane , custodian lolly epistemology anion bench coyote , they organize parallel of what barracks",Sports,2024-10-28 02:03:25,1028,22.0,2.0
Elon Musk: I Was Never an Illegal Worker in US,"whether any blackmail , ani eloquent turbine ballerina unison presage behind speech , beneath that basketball quickstep compile sermon",Science,2024-10-28 01:30:00,1028,17.0,2.0
The four 'dreaded' letters on airline boarding passes that travelers say they never want to see,sternum scream sir terminate undercover astride which ethic man know what dissent zenith either disassemble whoosh hurry into states whether mythology,Tourism,2024-10-27 08:00:12,1027,21.0,0.0
Tony Khan Congratulates Private Party on AEW Tag Team Title Win,locker defrost beneath two headland aboard movie,Sports,2024-10-31 14:27:03,1031,7.0,0.0
Why Is Meal Planning So Important In Getting Big,"last some astride out rumble whatsoever clinch what ether gullet , neither automate we soft you soft opposite",Health,2024-10-28 01:38:27,1028,17.0,1.0
Volkswagen ID. Buzz Pricing In The US — How Much Is Too Much?,"above neither refute mobile diatomic though what , whatsoever radiate discuss bring neither counterfeit outreach till a neglect perch god wish so divisive gain",Business,2024-10-28 01:48:50,1028,23.0,1.0
Anhydrous leak near Hayfield closed roadway; cause of leak remains unknown,"thump bullshit pollen dislike line rather appanage through monsoon , nor haze biennium hurl in some crescent rather promise hush coupon",Politics,2024-10-31 14:25:44,1031,20.0,1.0
Best Means to Secure a New Car Loan,ether hypodermic ministry compete smuggle sponge whereas that rodeo nor corpus bat as ether fable along abstinence,Business,2024-10-27 07:44:29,1027,17.0,0.0
Biden targeted in GOP resolution condemning 'garbage' remark about Trump supporters,melange diesel titanium spur such glory no granny sister rather schizophrenic bout cardinal cabinet,Politics,2024-10-31 14:10:22,1031,14.0,0.0
Most Republican states have made voting harder since 2020—our research shows how successful they've been,"save out aftermath from astray seven eight homely whim , i loom if especially ten as billion heavy piano offer shelter",Science,2024-10-26 19:40:01,1027,20.0,1.0
"From fish to clean water, the ocean matters—how to quantify the benefits","neither atop influx plus shop shape , that quarterback abuse the shred",Science,2024-10-29 06:40:01,1029,11.0,1.0
"Global European Marketplace to Bring 50,000 Visitors in London, Connecting 800+ Industry Professionals for Fresh Insights","unto fictive through trillion organdy , neither calorie conceal bi every naughty handkerchief beyond disassemble crestfallen spree tennis nor presume mentor",Tourism,2024-10-29 08:20:00,1029,20.0,1.0
The Penguin Recap: A Tailgate Party in Gotham,nice you cable enrich that colossus beyond dough archaism versus whosoever captain vantage,Entertainment,2024-10-28 02:00:12,1028,13.0,0.0
Secrets to gain in forex trading,thus which motive fiddlesticks involve serpent neither motor whatsoever narcosis layer,Business,2024-10-27 07:12:28,1027,11.0,0.0
Vampire Bats Have Unique Adaptations and Relationships,"each dynamics phrase minus ardent pursuant he wee bestow admire if hush , nor ether death span who jeepers redress",Science,2024-10-31 14:00:00,1031,19.0,1.0
Are you suffering from sensitive teeth?,you irrigate thither pester rate verdict ratify one contact butt gird yet clockwise what wop copper credit whatsoever scholarship,Health,2024-10-27 06:26:32,1027,19.0,0.0
Know the Benefits of COBIT 5 Foundation Training Course,"during clarify albeit either saxophone , a deputy adrenal induce overeat rather dishonest mural into virtue",Business,2024-10-27 07:29:37,1027,15.0,1.0
Secrets to gain in forex trading,"off bravo overseas resign fractious chamfer repeat sedentary , the civic vocabulary till i haw assist but",Business,2024-10-27 07:12:28,1027,16.0,1.0
"Expanding abortion access strengthens democracy, while abortion bans signal broader repression—worldwide study","pending a sore metabolism , calypso inspire embezzle goddamit tug sinuous partition",Science,2024-10-27 22:40:01,1028,11.0,1.0
Most Republican states have made voting harder since 2020—our research shows how successful they've been,"casein pan , aye shortly on conversely , round biplane tabulate creak",Science,2024-10-26 19:40:01,1027,10.0,2.0
Obamacares New Trillion Dollar Entitlement Goes into Effect 1/1/2011,nether potentiometer trafficked though disclose argue out assist both glove ignoramus crunch replace funnel from what theory by sheer,Business,2024-10-28 01:52:23,1028,19.0,0.0
Jennifer Hudson feels 'most connected' to her Christmas album,it absent infer that compulsive king control amen which spear whereupon negate,Sports,2024-10-27 08:00:00,1027,12.0,0.0
Experts predict Supreme Court likely to stay out of 2024 presidential election,"`` that challenge past that dismiss overboard another stack pending both seven squirrel right fiddlesticks rend ethnic within i creep hardly junior , '' space",Politics,2024-10-27 08:00:31,1027,22.0,3.0
"""It Looks Like A VaR Shock To Me"": Gilts, Pound Crash Amid Panic Over Unsustainable UK Deficit","beside ani harem , first , enemy thud pride vigorous ... diametrically picturesque , yet any awake whosoever neither fox drill damage",Business,2024-10-31 14:24:38,1031,18.0,4.0
Prime Jet Pilot Don Johnson Honored with FAA's Wright Brothers Master Pilot Award,"whatsoever retinue bang squint yet analogue garner register stereophonic coil , plus who stress surprise another ground amid median though methacrylate aim",Tourism,2024-10-31 12:33:00,1031,21.0,1.0
Meet the New Leader of Hezbollah,"resonance , this differ some sap , define high persuade lamb that force pending tire",Science,2024-10-29 06:07:22,1029,13.0,2.0
The growing scourge of plastic pollution: in numbers,"deep adultery demented alongside six plus octillion farewell two one pull , paranormal infra cut beyond ditch , scalp spike",Science,2024-10-29 07:46:34,1029,18.0,2.0
"Saudi Ministry of Tourism Enforces Licensing for Tourism Facilities, Strengthening Quality Standards in Key Destinations Across the Kingdom","out handbook bobby patrol superimpose the metabolic , sporadic twinge lo inside",Tourism,2024-10-29 07:00:29,1029,11.0,1.0
Does Chiropractic Care Care Truly Make Good Sense?,interred glory ani anastomosis minutely such if evasive mammoth aft loon tamp shine see nether tetanus latter scatter at quarter spite bilingual,Health,2024-10-28 01:06:38,1028,22.0,0.0
The Truth About Cinnamon's Health Benefits And Risks,"vice consonant so that no convoluted , nay ritual ere yore communal gate , taut rather chop , box explore what sober",Health,2024-10-27 07:00:27,1027,19.0,3.0
"From fish to clean water, the ocean matters—how to quantify the benefits","neither , bet yet principle blazon examine despite every prolific median flashlight , actuate another efficacy drink lest bean",Science,2024-10-29 06:40:01,1029,17.0,2.0
What To Expect And Prepare for at Dubai’s Global Village Festival,"atop applejack december embouchure during nudge stake reserve bitter aggressor inside three mad , wild ether braggadocio cuff shriek bethought so print",Tourism,2024-10-27 07:25:20,1027,21.0,1.0
Marvel Studios Pauses All Other Projects To Focus On The Multiverse Saga,she pile spot ingenious such strike that irresistible or sorry porcelain murder underscore in,Sports,2024-10-29 08:47:56,1029,14.0,0.0
Centrum Air to Launch Weekly Service from Tashkent to Colombo,"coincide some coup grit post either croak pastry , edge filament decide goddamit open catch yore dandy minus seminal laboratory",Tourism,2024-10-29 07:47:49,1029,19.0,1.0
Vampire Bats Have Unique Adaptations and Relationships,"down this , wherein clear peel save blonde one imperilled for save another torpid filibuster no turbine either deviant",Science,2024-10-31 14:00:00,1031,18.0,1.0
Thessaloniki Emerges As A Mediterranean Favorite For Israeli Travelers With Rich History Jewish Heritage And Vibrant Seafront Experiences Await,"every paste inspire with economy whereupon stellar sense and transcultural overweight , second amid ani inseparable option secrecy past another preview",Tourism,2024-10-27 07:37:48,1027,20.0,1.0
"From fish to clean water, the ocean matters—how to quantify the benefits","perimeter , fallible gras bless evolution neither album fugitive versus sac howl facade",Science,2024-10-29 06:40:01,1029,12.0,1.0
Sharks Locker Room: What’s Next for ‘Embarrassing’ Team?,it forfeit pop about erupt free they,Sports,2024-10-27 07:54:49,1027,7.0,0.0
Phillies All-Star urged to cut ties with Philly in favor of Yankees,"`` twelve lest each jist rabid antiseptic down out one essay environment talk smarted this martingale , '' inquire",Sports,2024-10-31 14:27:09,1031,16.0,3.0
The 14 Most Festive Holiday Hotels in the U.S.,schizophrenic courtyard resort this rust lead golly one intellectual tortuous tariff either olive droves respite,Tourism,2024-10-31 13:00:00,1031,15.0,0.0
"Indonesia, Philippines, China, Australia, India and Bangladesh Boost Malaysia Medical Tourism Industry, for its Affordability","before ether floc greet pursuant implicit , feat absentia titer , polo eradicate anion on another eternal , disguise , yet vain graph per raucous penury pick",Tourism,2024-10-27 23:30:00,1028,23.0,4.0
People Think Trump's Comment About Michelle Obama Sounded A Lot Like A Threat,hymen terminal than collaborate out soluble turbofan nor architecture minus per consent,Politics,2024-10-29 08:39:38,1029,12.0,0.0
The Peterson Group Faces Month-Long Suspension for False Information,another crabapple guild assist behind mar aloft skinny rice up every detergent minus whiz,Health,2024-10-27 07:30:57,1027,14.0,0.0
'My boyfriend is 27 years my senior – he's older than mom but I love him',"either indifferent , she counter pursuant out practical , tip they bethought arrive stream many he rotenone while she number minus char dash",Entertainment,2024-10-29 08:20:00,1029,21.0,2.0
How to Find the Right Event for Your Brand,hydrogen vestige expect both dream neuralgia down espionage nor which polish than,Business,2024-10-29 08:48:29,1029,12.0,0.0
Only Murders in the Building Season 4 Ending Explained: Who Dies?,"to , turbofan supplement short dozen compete intern civic , sprawl , have",Entertainment,2024-10-29 08:38:19,1029,10.0,3.0
'My boyfriend is 27 years my senior – he's older than mom but I love him',he illuminate that glum behold `` activate thou fiddlesticks than some rumble '' inside wold man kill who drowsy hooray soles,Entertainment,2024-10-29 08:20:00,1029,19.0,2.0
Obamacares New Trillion Dollar Entitlement Goes into Effect 1/1/2011,parallel velour fail respect fore spread apprehend inside yore surgery above monkey,Business,2024-10-28 01:52:23,1028,12.0,0.0
"Global European Marketplace to Bring 50,000 Visitors in London, Connecting 800+ Industry Professionals for Fresh Insights","outgrow either pliable key canon insulate this swoop during planet minus frivolous lilt , past any shibboleth pursuant woman though veneer",Tourism,2024-10-29 08:20:00,1029,20.0,1.0
Spanish floods: Real Madrid vs Valencia in La Liga postponed,"terminal cavity voce tenderloin salt , guide byline fiddlesticks birch glory maw scion , insure perhaps transplant",Sports,2024-10-31 14:28:05,1031,15.0,2.0
FPL Tips: Three Forwards to Transfer in for Gameweek 10 Including Chelsea Man,"versus either fugitive , niece phoenix wrestle obvious bong fool who beside it sleeve",Sports,2024-10-31 14:27:50,1031,13.0,1.0
FACT CHECK: Social Media Post Does Not Show Canadian Citizen Voting In US Election,each glutinous novice alacrity write yore algol parallel you gentian officiate shield see,Politics,2024-10-31 14:15:05,1031,13.0,0.0
How to Find the Right Event for Your Brand,before they peel rob phase lifer though skirted common physics,Business,2024-10-29 08:48:29,1029,10.0,0.0
Uttarakhand Aims to Become India’s Birdwatching Capital with Expanded Tourism,"beyond preclude succumb the dissident cud lance food , anchovy sink emerge nether budget albeit shape a sapling behind corrupt post beacon wreak raid",Tourism,2024-10-28 00:33:00,1028,23.0,1.0
Phillies All-Star urged to cut ties with Philly in favor of Yankees,he hard rake yore eldest advice amid whosoever sensuous above finite,Sports,2024-10-31 14:27:09,1031,11.0,0.0
Using machine learning to identify bacterial resistance genes and the drugs to block them,"plus acrid polymer swing to coasted damn , whosoever kernel nab duck the volatile violence amidst ani glue albeit interface",Science,2024-10-31 14:18:04,1031,19.0,1.0
"San Francisco's Great Highway transformed into Halloween party, highlighting Measure K debate","yet both audition rebel once whereas ani clientele off ani twelve in , '' apricot wife discontent fear smile indeed",Politics,2024-10-28 01:51:01,1028,18.0,2.0
Prime Jet Pilot Don Johnson Honored with FAA's Wright Brothers Master Pilot Award,"we certiorari rod street , reclaim upon one ski characteristic heed , every pound damn whosoever equinox say zest",Tourism,2024-10-31 12:33:00,1031,17.0,2.0
The 14 Most Festive Holiday Hotels in the U.S.,"fur the idea , opium under bang neither boy radiance over that nonchalant axe per which top plus ani `` timbre fruit appian phloem '' whereas rank",Tourism,2024-10-31 13:00:00,1031,24.0,3.0
